,Type,District,Storage name,Address,Manager Name,Mobile No,Capacity in MT
1050,Cold Storages,Gondia,Ramesh Chandrabhan Jain,Arjuni Morgaon,,,264.0
1051,Cold Storages,Gondia,Sh. Abaji Vithoba Aswale,Kudwa,,,250.0
1052,Cold Storages,Gondia,Shree Randal Warehousing (Kiritbhai Ishwaebhai Patel & Chirag Dineshbhai Patel ),"Village: Mundipar, Tah Dist: Gondia",,,3000.0
1053,Cold Storages,Gondia,"Shri Dada Ramaji Funde, Arjun Morgaon, Dist.Gondia",ArjunMorgaon,,,428.4
1054,Cold Storages,Gondia,"Shri Santosh Radhalal Katre, Shri Satish Radhalal Katre","At Post: Kalimati, Tah: Amgaon, Dist: Gondia",,,431.5
1055,Cold Storages,Gondia,Shri Zamsing Bhuraji Yerne,"P-1,MIDC-Deori Individual Ustrial Area ,Dist.Gondia",,,1945.16
1056,Cold Storages,Gondia,Shri. Randal Warehousing,Mundipar,,,3000.0
1057,Cold Storages,Gondia,Smt Mamta Ghanshyam Asati,"Natraj Marg, Amgaon, Dist: Gondia",,,878.0
1058,Cold Storages,Gondia,Smt Rajkiran Vijaykumar Agrawal,"At Village: Risama, Tah:Amgaon, Dist: Gondia",,,775.0
1059,Cold Storages,Gondia,"Smt. Mamta Ghanshyam Asati,Amgaon","At Gortha,Tq:Amgaon",,,200.0
1060,Cold Storages,Gondia,Vishnuprasad Ramjilal Agarwal,Deori,,,1025.0
1061,Cold Storages,Hingoli,Buldhana Urban Co-Op Credit Society Ltd,"GUT NO 54,MOUJE,SASEWADI,TQ HINGOLI,DIST.HINGOLI",,,998.0
1062,Cold Storages,Hingoli,Buldhana Urban Co-Op Credit Society Ltd (Godown No.3),"GUT NO 54,MOUJE,SASEWADI,TQ HINGOLI,DIST.HINGOLI",,,1977.0
1063,Cold Storages,Hingoli,Dr. Ashok Narayan Paturkar,Limbala MIDC,,,1234.0
1064,Cold Storages,Hingoli,Gramin Bhandaran Yojana (Pro. Smt Meenatai Suresh Kharate),"At Fattepur, Tal. Basmathnagar, Dist. Hingoli",,,996.14
1065,Cold Storages,Hingoli,Laxmi Warehouse,"Gut No. 34 A, At Limbala Muktha, Tal. Hingoli",,,3000.0
1066,Cold Storages,Hingoli,M/S Pawar Warehouse(Prop. Smt. Savitri Dasrao Pawar),"Gut No 254, Khambala, Tal & Dist. Hingoli",,,295.221
1067,Cold Storages,Hingoli,M/S Vimal Warehousing,"G No. 1104, A/P: Wadki, Tal: Haveli, Dist: Pune - 412308",,,4503.0
1068,Cold Storages,Hingoli,Mrs.Surekha C.Nilamwar,"B-57,MIDC,Hingoli",,,1201.18
1069,Cold Storages,Hingoli,Sau Meeratai Gajananrao Deshmukh,"Gut No. 192, At: Sapatgaon, Tal: Sengaon, Dist: Hingoli",,,1000.0
1070,Cold Storages,Hingoli,Sau Saroj Sahebrao Deokate,"At : Aundha Nagnath, Dist: Hingoli",,,180.0
1071,Cold Storages,Hingoli,Sau.Shakuntala Kishan Deshmukh,"Hno-150,Mz:Taktoda,Tq:Sengaon",,,110.251
1072,Cold Storages,Hingoli,Shree Gajanan Warehousing,"Gut No. 193, Satipangra, Tal: Basmat Nagar, Dist: Hingoli",,,8328.0
1073,Cold Storages,Hingoli,Shri . Prabhakar Madhavrao,Girgaon,,,200.0
1074,Cold Storages,Hingoli,Shri Janardhan Kishanrao Gawande,"Gno-2/2,Mz:Dongarkada,Tq.Kalamnuri",,,561.163
1075,Cold Storages,Hingoli,Shri Narayan Shriram Sawke,"Gno-266,Mz:Taktoda,Tq:Sengaon",,,110.251
1076,Cold Storages,Hingoli,Shri Ramesh Navale,Hingoli,,,605.0
1077,Cold Storages,Hingoli,Shri. Arun Narayan Paturkar,Limbala MIDC,,,1234.0
1078,Cold Storages,Hingoli,Shri. Avinash Narayan Paturkar,Limbala MIDC,,,1234.0
1079,Cold Storages,Hingoli,Shri. Nivruti Tukaram Gavande,Kamergaon,,,149.328
1080,Cold Storages,Hingoli,Shri. Pandit Bahirji ShIndividual E,Singi Khamba,,,202.0
1081,Cold Storages,Hingoli,Shri. Ramji Ganapati Bhalerao,Kanerkheda,,,150.0
1082,Cold Storages,Hingoli,Shri. Shivshankar Bahirji ShIndividual E,Singi Khamba,,,202.0
1083,Cold Storages,Hingoli,Smt Indubai Babarao Deshmukh,"Sapatgaon, Tal: Sengaon, Dist: Hingoli",,,1000.0
1084,Cold Storages,Hingoli,Smt Rajashri Vinay Bantiya,"Gut No. 3, Village: Limbala Makta, Tal & Dist: Hingoli",,,2491.36
1085,Cold Storages,Hingoli,Smt. Alka Rajkumar Vyawhare,"S No. 98,AT POST SHEVALA TAL. KALAMNURI DIST.HINGOLI",,,1039.68
1086,Cold Storages,Hingoli,Smt. Gangabai Rameshwar Murkya,"Ganeshpur, Tal. Basmathnagar, Dist. Hingoli",,,4480.0
1087,Cold Storages,Hingoli,Sou Sunita Shyamsunder Agrawal,"Gut No. 24, At: Sasewadi, Tal & Dist: Hingoli - 431 513",,,4629.01
1088,Cold Storages,Hingoli,Sow Anita Pradeep Golechha,"S No. 44, Basmath, Dist: Hingoli",,,979.0
1089,Cold Storages,Hingoli,Sow Pragati Jagdish Sharma,"Gut No. 3, Village: Limbala Makta, Tal & Dist: Hingoli",,,100.0
1090,Cold Storages,Hingoli,Tushar Warehouse (Prop.Smt Shilpa S Patange),"Gat No.61/1/3, At Dati, Post Kurtadi, Tal. Kalamnuri, Dist. Hingoli",,,2687.0
1091,Cold Storages,Hingoli,Veena Vyankatesh Kaurwar,"Gat No. 3, Village: Limbala Makata, Tal & Dist: Hingoli",,,1000.0
1092,Cold Storages,Jalgaon,Atul S Sanghavi,"Goradkheda (Bk), Tal. Pachora, Dist. Jalgaon",,,1000.0
1093,Cold Storages,Jalgaon,BANOTIWALA WAREHOUSE(SMT LILABAI CHAMPALAL JAIN & SMT VANDANA MANOJ JAIN),"GAT NO 118 BAMBRUD KU,PACHORA TQ PACHORA,DIST JALGAON",,,3973.0
1094,Cold Storages,Jalgaon,Bhadli (Bk.) V.K.S.Society Ltd.,"Gno-1001,At Bhadli(Bk.),Tq.& Dist.Jalgaon",,,302.389
1095,Cold Storages,Jalgaon,Bharatgir Dhudkugir Gosavi,"Nagaon, Tal: Amalner, Dist: Jalgaon",,,425.5
1096,Cold Storages,Jalgaon,Buldhana Urban Co-Op Credit Society Ltd,"GODOWN NO.3 & 4 GUT NO 99/2 MOUJE CHINCHOLI TQ JALGAON,DIST JALGAON",,,7852.0
1097,Cold Storages,Jalgaon,Buldhana Urban Co-Op Credit Society Ltd,"GUT NO 592/2,MOUJE BODWAD,TQ BODWAD,DIST JALGAON",,,958.0
1098,Cold Storages,Jalgaon,Buldhana Urban Co-Op Credit Society Ltd,"GUT No592/2 Mouje Bodwad TQ Bodwad,DIST:jalgaon",,,958.0
1099,Cold Storages,Jalgaon,Buldhana Urban Co-Op Credit Society Ltd,"GODOWN NO.1 & 2 GUT NO 99/2 MKOUJE CHINCHOLI,TQ JALGAON,DIST JALGAON .",,,7852.0
1100,Cold Storages,Jalgaon,Buldhana Urban Co-Op Credit Society Ltd,"Gut No.61-1b,61-1A,AT Mouje Fatepur,Malegaon,TQ Jamner,DIST:Jalgaon",,,985.0
1101,Cold Storages,Jalgaon,Damu Kisan Patil,"At Pahan, Tal: Pachora, Dist: Jalgaon",,,132.33
1102,Cold Storages,Jalgaon,Dhanshree Mahila Gram SPS Bodwad,Tal.Bodwad,,,250.0
1103,Cold Storages,Jalgaon,Eknath Tryambak Chaudari,"CTS 611, Gudeh Village, Tal. Chalisgaon",,,111.66
1104,Cold Storages,Jalgaon,Gangadhar Sitaram Chaudhary,Virode,,,204.59
1105,Cold Storages,Jalgaon,Girnai Nagari Sahakari Pantsanstha,Krishnapuri,,,2319.12
1106,Cold Storages,Jalgaon,Gulabrao Murlidhar Patil,"A/P Adawal, Tal. Chopda, Gut No.21/2, Dist. Jalgaon",,,329.47
1107,Cold Storages,Jalgaon,Jeevan Onkar Chaudhari (HUF),"Gat No.5, Dhanora Pra Yo, Tal Chopda, Dist. Jalgaon",,,1198.0
1108,Cold Storages,Jalgaon,Kathora V K S Society Ltd,"Kathora, Tal: Chopda, Dist: Jalgaon",,,250.38
1109,Cold Storages,Jalgaon,M/S APMC Bodwad,Bodwad,,,916.0
1110,Cold Storages,Jalgaon,M/S Ainpur VKS,Ainpur,,,300.0
1111,Cold Storages,Jalgaon,M/S Atco Warehouse,Kanadi,,,7565.0
1112,Cold Storages,Jalgaon,M/S Balaji Agro Seeds Corporation,Shivani,,,220.0
1113,Cold Storages,Jalgaon,M/S Balaji Warehouse (Prop. Anil Uttamchand Jain,"Gat No.1394/1A, A/P Pahur, Tal. Jamner, Dist. Jalgaon",,,974.268
1114,Cold Storages,Jalgaon,M/S Chunchale VKS,Chunchale,,,200.0
1115,Cold Storages,Jalgaon,M/S Ghdasgaon VKS,Ghodasgaon,,,250.0
1116,Cold Storages,Jalgaon,"M/S Kanalda VKS Ltd.,",Kanalda,,,250.0
1117,Cold Storages,Jalgaon,M/S Mahesh Hybrid Seed Co,Shivar,,,220.0
1118,Cold Storages,Jalgaon,"M/S Mangalmurthi Nagari Sah. Patsanstha, Parola",Parola,,,700.0
1119,Cold Storages,Jalgaon,"M/S Shankar S. S. K. Ltd., Sadasivnagar",Sadashivnagar,,,10000.0
1120,Cold Storages,Jalgaon,M/S Somani Warehousing & Agroprocessing,"Sno-31/1,Jalna-Beed Road,Ambad",,,1175.54
1121,Cold Storages,Jalgaon,M/S Varkhede Bhudruk VKS,Varkhde,,,250.0
1122,Cold Storages,Jalgaon,M/S Yashika Warehousing (Smt. Archana Rajesh Ghadge) � Godown No.1,"At Po: Mirghavan, Tal: Bhusawal, Dist: Jalgaon",,,1029.73
1123,Cold Storages,Jalgaon,M/S Yashika Warehousing (Smt. Archana Rajesh Ghadge) � Godown No.2,"Gat No.13/2, At Po: Mirghavan Shivar, Tal: Bhusawal, Dist: Jalgaon",,,994.63
1124,Cold Storages,Jalgaon,M/S Yashika Warehousing (Smt. Archana Rajesh Ghadge) � Godown No.3,"Gat No.13/2, At Po: Mirghavan, Tal: Bhusawal, Dist: Jalgaon",,,994.63
1125,Cold Storages,Jalgaon,Manoj Amrutlal Patel,"Gut No. 412, At Post: Bodwad, Tal: Bodwad, Dist: Jalgaon, PIN : 425310",,,931.0
1126,Cold Storages,Jalgaon,Mohanchand Narayan Sonawane,"Gramin Bhandaran Yojana, At Karanj, Dist. Jalgaon",,,146.324
1127,Cold Storages,Jalgaon,Mr Hirasing Lakhansing Thakur,"At Deulgaon Gujari, Tal: Jamner, Dist: Jalgaon",,,500.0
1128,Cold Storages,Jalgaon,Mr Prakash Kesharlal Bohra (Marwadi),"G No. 92, Palakhed Kh, Tal: Parola, Dist: Jalgaon",,,100.0
1129,Cold Storages,Jalgaon,"Mr. Bhagwat Sitaram Choudhary,A/P-Tandalwadi","CTS-No.-529,A/P-Tandalwadi.Tq:Raver",,,163.0
1130,Cold Storages,Jalgaon,"Mr. Devidas Ramchandra Patil,A/P-Tandalwadi","CTS-No-475,At Tandalwadi,Tq:Raver",,,211.0
1131,Cold Storages,Jalgaon,"Mr. Laxmikant J. Suryawanshi,Nandre","Sr.No-113/4,A/P-Nandre,Tq:Pachora",,,976.0
1132,Cold Storages,Jalgaon,Mr. Madhukar Suklal Chaudhary,"Gno-63,At Nandri,Tq.Amalner",,,196.155
1133,Cold Storages,Jalgaon,"Mr. Raghunath Shankar Patil & Others,A/P-Tandalwadi","Gno-221,At Sunoda,Tq:Raver",,,339.0
1134,Cold Storages,Jalgaon,Mr. Sanjaya Dayaram Patil,"Sno-798/A/2B,Kalamsara,Tq:Pachora",,,285.935
1135,Cold Storages,Jalgaon,Mrs Jijabai Dnyaneshwar Pawar & Mrs Mirabai Sopan Pawar,"Gat No. 340, Village: Kajgaon, Tal: Bhadgaon, Dist: Jalgaon",,,549.89
1136,Cold Storages,Jalgaon,Ms Meghraj Cold Storage,G No 321 1 Ap Paldi Bu Sawada Ringangaon Road Tal Dharangaon Dist Jalgaon,Shri Purushotam Subhashchandra Navandar,,2860.0
1137,Cold Storages,Jalgaon,Nanasaheb Babanrao Deshmukh,"G. No. 83/1A1, At Tongaon, Tal. Bhadgaon",,,850.0
1138,Cold Storages,Jalgaon,Navkar Warehouse (Dilipchand Uttamchand Jain),"Gat No. 1394/1, A.P. Pahur, Tal. Jamner, Dist. Jalgaon",,,988.0
1139,Cold Storages,Jalgaon,Padamsing Dhansing Pardeshi,At Po.Parola,,,119.0
1140,Cold Storages,Jalgaon,Pallavi Atul Sanghavi,"Tal Pachora, Dist. Jalgaon",,,1000.0
1141,Cold Storages,Jalgaon,Pradipkumar Agrawal & Prakash Agrawal,"Gat No. 240/1+241/4, Plot No. 2,3,4,13,14,15,16 & 17, At Post: Bodwad, Tal: Bodwad, Dist: Jalgaon � 425310",,,1646.0
1142,Cold Storages,Jalgaon,Premji Lalji Patel,"Gat No. 412, Bodwad, Tal: Bodwad, Dist: Jalgaon, PIN : 425310",,,931.0
1143,Cold Storages,Jalgaon,Rajmal Khubchand Agrawal,"Gat No. 238/1, Bodwad, At Post: Bodwad, Tal: Bodwad, Dist: Jalgaon - 425310",,,1324.0
1144,Cold Storages,Jalgaon,Ramesh Nagraj Patil,"Gat No. 4/2, Chorwar, Raver",,,507.855
1145,Cold Storages,Jalgaon,Ravindra Nago Patil,"Sno-112/2,Bhatsar,Tq.Bhadgaon",,,191.318
1146,Cold Storages,Jalgaon,Sangavi Bk VKS Sah Society Ltd,"Sangavi Bk, Tal: Yawal, Dist: Jalgaon",,,249.898
1147,Cold Storages,Jalgaon,Sanghvi Agriculture Marketing Processing Pvt. Ltd. (Godown 2) (Padmabai S Sanghavi),"Padmabai S Sanghvi , Gat No.213/4, At Gorodkhea (B), Tal. Pachora, Dist. Jalgaon",,,1000.0
1148,Cold Storages,Jalgaon,Sau.Pranjal Jayant Patil,"GNo.485,At & Tq.Jamner",,,100.0
1149,Cold Storages,Jalgaon,Sheshrao Laxman Vasu,Pahur,,,1000.0
1150,Cold Storages,Jalgaon,Shravan Ramchandra Badgujar,"R/O Lohari Bk, Tal: Pachora, Dist: Jalgaon",,,44.39
1151,Cold Storages,Jalgaon,Shri Bharat Dattatraya Patil,"Plot-51,Gno-3,At Adgaon,Tq.Chopada",,,247.905
1152,Cold Storages,Jalgaon,Shri Bharat Rupsing Jadhav,"Gno-255/1/1,At Adgaon,Tq.Chopda,Jalgaon",,,153.826
1153,Cold Storages,Jalgaon,Shri Bhaskar Dayaram Choudhary,"Gno-87/1,At Nimbhorasim,Tq.Raver",,,182.8
1154,Cold Storages,Jalgaon,"Shri Dagdu Sonaji Ingole, Kinhi",Kinhi,,,200.0
1155,Cold Storages,Jalgaon,Shri Deepak Gulabrao Patil & Others,"Gno-5,At Dahiwad,Tq:Amalner",,,232.337
1156,Cold Storages,Jalgaon,Shri Dilip Chattarsing Rajput,"A/P-Wakadi,Tq.Jamner",,,100.0
1157,Cold Storages,Jalgaon,Shri Dilip P Choudhuri,Bhokri,,,504.0
1158,Cold Storages,Jalgaon,Shri Kailash Mukund Mahajan,"Gno-1776/1,At Raver,Tq.Raver",,,548.91
1159,Cold Storages,Jalgaon,Shri Mangalmurti Nagri Sah.Patsanstha Ltd.,Parola,,,11.7298
1160,Cold Storages,Jalgaon,Shri Murlidhar Tukaram Mahajan,"Cts No.950,Waghoda(Bk),Tq.Raver",,,245.25
1161,Cold Storages,Jalgaon,Shri Pitambar Murlidhar Patil,"Tapat Kathora, Tal. Bhusaval, Dist. Jalgaon",,,478.65
1162,Cold Storages,Jalgaon,Shri Prakashchand Hukumchand Oswal,"Gat No. 584, Plot No. 3, 4, & 5, A.P. Bodwad, Tal. Bodwad, Dist. Jalgaon",,,1089.0
1163,Cold Storages,Jalgaon,Shri Premchand Humunchand Jain,"Gat No. 42, A.P. Betawad, Dist. Jalgaon",,,310.76
1164,Cold Storages,Jalgaon,Shri Radheshyam S Vyas,Transport Nagar,,,10000.0
1165,Cold Storages,Jalgaon,Shri Sureshchandra K. Kothari,"Gno-343/1/1,Pachora Road,Jamner",,,802.93
1166,Cold Storages,Jalgaon,Shri Sureshchandra K.Kothari,"Gno-343/1/1,At & Tq:Jamner",,,802.937
1167,Cold Storages,Jalgaon,Shri Vishwas Ragho Bhosale,"At Post: Pimpalkhede, Tal: Bhadgaon, Dist: Jalgaon",,,218.0
1168,Cold Storages,Jalgaon,Shri Vitthal Dagdu Patil & Shriram Vitthal Patil,"Hno-112,At Anwarde,Tq:Chopda",,,500.0
1169,Cold Storages,Jalgaon,Shri. Bhagwan Vishwanath Patil,Pimparipancham,,,495.0
1170,Cold Storages,Jalgaon,Shri. Digambar Rajaram Patil,Nandurkhede,,,1000.0
1171,Cold Storages,Jalgaon,Shri. Ganesh Kadu Patil,Karki,,,602.0
1172,Cold Storages,Jalgaon,Shri. Ganesh Raghunath Patil,Ainpur,,,496.0
1173,Cold Storages,Jalgaon,Shri. Hiraman Shankar Patil,Tamgavhan,,,190.0
1174,Cold Storages,Jalgaon,Shri. Jagannath Kashinath Mahajan,Padale,,,158.76
1175,Cold Storages,Jalgaon,Shri. Rajaram Shambu Chaudhary,Ahirwadi,,,310.0
1176,Cold Storages,Jalgaon,Shri. Shriram Kanhaiyalal Agrawal,Bhatkhede,,,1000.89
1177,Cold Storages,Jalgaon,Shri. Sudhakar Sitaram Patil,Nandurkhed,,,1000.0
1178,Cold Storages,Jalgaon,Shri. Trambak Jaggu Patil,Nimbol,,,1000.0
1179,Cold Storages,Jalgaon,Shri. Vishal Yuvraj Patil,Kerhale,,,225.0
1180,Cold Storages,Jalgaon,Smt Manisha Sanjiv Patil,"At Manaki, Tal. Bhadegaon, Dist. Jalgaon � 424 201",,,523.0
1181,Cold Storages,Jalgaon,Smt Sunita Nilesh Dargad (Godown No.2),"Sr.No.29/4, N.H.No.6, Village Fekari, Taluka Bhusawal, Dist. Jalgaon",,,998.72
1182,Cold Storages,Jalgaon,Smt Vimalbai Vasant Patil,"A/P: Tandulwadi, Tal: Raver, Dist: Jalgaon",,,500.0
1183,Cold Storages,Jalgaon,Smt. Nirmalabai Shantilal Jain,"Gat No. 72, A.P. Shendurni, Tal Jamner, Dist. Jalgaon",,,988.0
1184,Cold Storages,Jalgaon,Smt. Ratnabai Suresh Patil,Karki,,,617.0
1185,Cold Storages,Jalgaon,Sow. Sakhubai Hari Mahajan,Tandalwadi,,,500.0
1186,Cold Storages,Jalgaon,Sunita Nilesh Dargad (Godown No.1),"No. 6, Village: Fekari, Tal: Bhusaval, Dist:Jalgaon",,,998.72
1187,Cold Storages,Jalgaon,Sureshchandra Kisanlal Kothari,"Gat No. 47/2, At Post: Waki Kh, Tal: Jamner, Dist: Jalgaon - 424206",,,4239.87
1188,Cold Storages,Jalgaon,Vijay Tulsiram Wani,"At Post: Khedgaon, Tal: Bhadgaon, Dist:Jalgaon",,,100.0
1189,Cold Storages,Jalgaon,Vijaykumar Nanasaheb Deshmukh,"G. No. 83/1A1, At Tongaon, Tal. Bhadgaon",,,940.0
1190,Cold Storages,Jalgaon,Vijaysing Kartarsing Rabde & Shri Kartarsingh Ramdas Rabde,"Gno-10,At Chinchkhed Nath,Tq. Motala",,,202.5
1191,Cold Storages,Jalgaon,Wadri V.K.S. Ltd.,Wadri,,,420.273
1192,Cold Storages,Jalgaon,Waghali V.K.S.Society,"At Post Wagholi, Tal. Chalisgaon",,,500.94
1193,Cold Storages,Jalgaon,Waman Ramchandra Patil,"Sno-237,At Shahapur,Tq.Amalner",,,310.807
1194,Cold Storages,Jalna,APMc Jalna,"At APMC.New Mondha,Jalna",,,2258.0
1195,Cold Storages,Jalna,Bagadia Ware House ( Prop: Mrs Neetadevi Pannalal Bagadia),"Gat No. 22, At: Devmurti, Tal & Dist: Jalna",,,4600.0
1196,Cold Storages,Jalna,Buldhana Urban Co-Op Credit Society Ltd,"GUT No7/9 AT MATREWADI,TQ BADNAPUR,DIST:JALNA",,,2420.0
1197,Cold Storages,Jalna,Buldhana Urban Coop. Credit Soc. Ltd,Jalna,,,283.0
1198,Cold Storages,Jalna,Chandrakalabai Balasaheb Golde,"Gat No. 13, Pimpalkhed (Khurd), Tal: Ambad, Dist: Jalna",,,194.86
1199,Cold Storages,Jalna,Jaibhavani Seeds & Agritech Research Pvt Ltd,"S No. 107, Waturphata Road, At & Po: Partur, Tal: Partur, Dist:Jalna",,,500.0
1200,Cold Storages,Jalna,M/S APMC Jalna,Jalna,,,4530.0
1201,Cold Storages,Jalna,M/S Krishidhan Vegetables Seeds (I) Pvt. Ltd.,"At Market Yard, Ring Road, Gat No.181, Sector No.33, ARMC, Jalna",,,9300.54
1202,Cold Storages,Jalna,"M/S Union Krishak Seva Sahakari Society Ltd.,",Ramnagar,,,1176.0
1203,Cold Storages,Jalna,Mr Rajendra Laxmikant Bhakkad & Mr Anil Chandraprakash Agrawal,"Plot No. Ap15 & AP16, Agro Processing Zone, New APMC Market Yard, Jalna - 431 203",,,2023.0
1204,Cold Storages,Jalna,Mr. Chatrabhuj Ramlal Chhabda,"Plot,G-3&4,New APMC Market Yard,Jalna",,,1994.96
1205,Cold Storages,Jalna,Mr. Kailash Mugutrao Deshmukh,"Gno-102,Mz:moharo,Tq:Jafrabad",,,1099.81
1206,Cold Storages,Jalna,SMT Tarabai Kundlik Suruse,"Gat No. 67, At: Nagik Pangri, Tal: Badnapur, Dist: Jalna",,,1000.0
1207,Cold Storages,Jalna,"Samarth SSK Ltd,Ankushnagar,Ambad","Site At Ankushnagar,Tq.Ambad,Dist.Jalna",,,9449.37
1208,Cold Storages,Jalna,Shambhu Mahadev Sugar & Allied Individual U. Ltd.,Gundewadi,,,6300.0
1209,Cold Storages,Jalna,Shri Bhalchand Kesharchand Jain,"G.No.305(P),At Rani-Unchegaon,Tq.Ghansawangi",,,233.383
1210,Cold Storages,Jalna,Shri Panjabrao Fakirrao Deshmukh,"Gat. No. 1168, Dhawada, Tal. Bhokardan, Dist. Jalna",,,1187.0
1211,Cold Storages,Jalna,Shri Prakash Sukhdev Lakhmale,"Sr.No.222,At Waghrul(JH),Tq.Dist.Jalna",,,704.494
1212,Cold Storages,Jalna,Shri Rajesh Tilokchand Patni,"Plot-AP_07&08,Sr.No.181,New APMC Makt Yard Road,Jalna",,,1773.34
1213,Cold Storages,Jalna,Smt Sharda Vishnu Kshirsagar,"At Post: Dharkalyan (Kadvanchi), Tal: Dist: Jalna",,,600.0
1214,Cold Storages,Jalna,Smt. Savita Loya & Smt. Kailas Loya,"Plot No G-1, G-2, S.NO. 102, New APMC Market Yard, Jalna",,,2049.16
1215,Cold Storages,Jalna,Tambe Arjun Namdeo,Lingewadi,,,121.22
1216,Cold Storages,Kolhapur,Amol Shubhash Todkar,"Gat No.624, A/P Ambap, Tal. Hatkangale, Dist. Kolhapur",,,950.0
1217,Cold Storages,Kolhapur,Anil Shubhash Todkar,"Gat No.624, A/P Ambap, Tal. Hatkangale, Dist. Kolhapur",,,950.0
1218,Cold Storages,Kolhapur,Babgonda VKS,Takawade,,,352.0
1219,Cold Storages,Kolhapur,Baburao Omanna Bhosale,"R.S.NO.116, Hissa No.9 & 10, Shiroli (P), Tal. Hatkangangale, Dist. Kolhapur",,,632.0
1220,Cold Storages,Kolhapur,Balasaheb Mane VKS,Shirol,,,403.0
1221,Cold Storages,Kolhapur,Bhagubai VKS,Bukihal(Kh.),,,275.0
1222,Cold Storages,Kolhapur,Bhagyalaxmi VKS,Narande,,,104.0
1223,Cold Storages,Kolhapur,Bhagyalaxmi Ware House,"Gno-822-23,A/P-Sarawade,Tq.Radhanagari",,,622.661
1224,Cold Storages,Kolhapur,Bhairavnath V.K.S.Sevasanstha,"At. Post. Nandani, Tal. Shirol",,,105.3
1225,Cold Storages,Kolhapur,Bhairavnath VKS,Vhagutti,,,111.0
1226,Cold Storages,Kolhapur,Bhairavnath VKS,Vetawade,,,174.0
1227,Cold Storages,Kolhapur,Bhairavnath VKS,Mahe,,,243.0
1228,Cold Storages,Kolhapur,Bharatratna Dr. Babasaheb Ambedkar VKS,Kuradwadi,,,235.0
1229,Cold Storages,Kolhapur,Bonjurdi V.K.S. Seva Sanstha Ltd.,Bonjurdi,,,220.0
1230,Cold Storages,Kolhapur,Chandgad Tal. Shetkari Sah. K V Sangh Ltd. Turkewadi ( Halkarni ),Halkarni,,,231.0
1231,Cold Storages,Kolhapur,Chandgad Tal. Shetkari Sah. K V Sangh Ltd.Turkewadi,Shinoli,,,1000.0
1232,Cold Storages,Kolhapur,Chandgad Tal. Shetkari Sah. K V Sangh Ltd.Turkewadi,Turkewadi,,,231.0
1233,Cold Storages,Kolhapur,Chougule JaypalBalappa,"Gat No. 470, Chougule Mala, A/P Jainapur, Tal: Shirol, Dist: Kolhapur",,,402.0
1234,Cold Storages,Kolhapur,Din Daulat VKS,Shirol,,,400.0
1235,Cold Storages,Kolhapur,Ghatprabha VKS,Kurani,,,333.0
1236,Cold Storages,Kolhapur,Girish Satyanarayan Agarwal,Pusad,,,1109.0
1237,Cold Storages,Kolhapur,Hanuman VKS,Kasba Thane,,,326.0
1238,Cold Storages,Kolhapur,Jagonda R Patil VKS,Shirti,,,234.0
1239,Cold Storages,Kolhapur,Jai Hanuman VKS,Kini,,,231.0
1240,Cold Storages,Kolhapur,Jai Shivray VKS,Sake,,,115.0
1241,Cold Storages,Kolhapur,JaihIndividual VKS,Nigwe,,,201.0
1242,Cold Storages,Kolhapur,Jawahar Shetkari VKS,Mangaon,,,210.0
1243,Cold Storages,Kolhapur,JayhIndividual V.K.S. Ltd.Kavathesar,"At Kavthesar,Tq:Shirola",,,278.0
1244,Cold Storages,Kolhapur,Jyotirling VKS,Nanundre,,,116.0
1245,Cold Storages,Kolhapur,Jyotirling VKS,Mahalaswade,,,118.0
1246,Cold Storages,Kolhapur,Kagal Tal.Sahakari KVS,Kagal,,,280.0
1247,Cold Storages,Kolhapur,Kalamevi VKS,Kasarwada,,,239.0
1248,Cold Storages,Kolhapur,Kamlakar R Sonavane & Sou Vijaya K Sonavane,"At P No. 1310, Gokul Shirgaon, Tal: Karveer, Dist: Kolhapur",,,3686.48
1249,Cold Storages,Kolhapur,Kedarling V.K.S. Seva Sanstha Ltd.,Boravade,,,233.0
1250,Cold Storages,Kolhapur,Kedarling VKS,Mandukli,,,174.0
1251,Cold Storages,Kolhapur,Kranti SSK Ltd.,Kundal,,,9454.0
1252,Cold Storages,Kolhapur,Laxmi VKS,Tamankwada,,,295.0
1253,Cold Storages,Kolhapur,"M/S Ajara Shetkari SSK Ltd.,",Gavase,,,10000.0
1254,Cold Storages,Kolhapur,M/S Apex Food Industries,"Plot No. 230, MIDC Kagal-Hatkanangale",,,945.0
1255,Cold Storages,Kolhapur,"M/S Datta VKS, Mouze Vadgaon",Vadgaon,,,116.272
1256,Cold Storages,Kolhapur,"M/S Gholeshwar VKS Ltd.,",Ghalwad,,,100.0
1257,Cold Storages,Kolhapur,M/S Gurudatt Sugars Ltd,"Gat No. 61, Akiwat - Takliwadi Road, Tal: Shirur, Dist: Kolhapur",,,11698.0
1258,Cold Storages,Kolhapur,M/S Gurudatt Sugars Ltd.,"Akiwat, Shirol",,,12500.0
1259,Cold Storages,Kolhapur,M/S HIndividual Mata VKS,Thergaon,,,200.0
1260,Cold Storages,Kolhapur,"M/S Individual Ira Gandhi Bharatiya Mahila Vikas SSK Ltd.,",Tambale,,,10000.0
1261,Cold Storages,Kolhapur,"M/S Kanur Group VKS Sanstha Ltd.,",Kanur Khurd,,,100.0
1262,Cold Storages,Kolhapur,M/S Rasaidevi VKS,Kolik,,,150.0
1263,Cold Storages,Kolhapur,M/S Sahyadri VKS,Male,,,150.0
1264,Cold Storages,Kolhapur,M/S Sahyadri VKS,Keloshi,,,150.0
1265,Cold Storages,Kolhapur,M/S Sangameshwar VKS,Terani,,,250.0
1266,Cold Storages,Kolhapur,"M/S Sharad SSK Ld.,",Narande,,,10000.0
1267,Cold Storages,Kolhapur,M/S Shri Radhakrishna Warehouse,Aiwajpur,,,1000.0
1268,Cold Storages,Kolhapur,M/S Shriram Sahakari Dudh Vyavasaik Sanstha Maryadit,Chuye,,,161.0
1269,Cold Storages,Kolhapur,"M/S Udaysingrao Gaikwad SSK Ltd.,",Sonawade Bambawade,,,10000.0
1270,Cold Storages,Kolhapur,"M/S Union Krishak Seva Sahakari Society Ltd.,",Manegaon ( Khalsa),,,250.0
1271,Cold Storages,Kolhapur,M/S Vikramsing VKS,Kumbhoj,,,521.0
1272,Cold Storages,Kolhapur,Mahadev VKS,Malge,,,195.0
1273,Cold Storages,Kolhapur,Maharashtra State Warehousing Corporation,"Midc,Plot No.T-6",,,3309.38
1274,Cold Storages,Kolhapur,Maharashtra State Warehousing Corporation,"APMC Premises,Loha",,,2974.98
1275,Cold Storages,Kolhapur,"Majarewadi V.K.S.Seva Sanstha Ltd.,",Majarewadi,,,237.0
1276,Cold Storages,Kolhapur,Mangesh V.K.S. Seva Sanstha Ltd.,"Ghunaki, Tal. Hatkangale, Dist. Kolhapur",,,200.0
1277,Cold Storages,Kolhapur,"Mr. Ajit M. Patil & Ranjit M. Patil,Nagaon","Gno-448,At Nagaon,Tq:Hatkanangle",,,452.0
1278,Cold Storages,Kolhapur,"Mr. G.B.Bookshet,Nagaon Phata","Gno-695,Nagaon,Tq:Hatkanagle",,,258.0
1279,Cold Storages,Kolhapur,"Mrs. Narmada Vijay Savekar,Uttur","Gno-1530(P),Uttur,Tq:Ajara",,,1000.35
1280,Cold Storages,Kolhapur,"Mrs.Manisha R. Hendre, Kolhapur","P-38,38/1,MIDC,Gokul-Shirgaon",,,1875.2
1281,Cold Storages,Kolhapur,"Mrs.Manisha R.Hendre,Kolhapur",Kowad,,,239.0
1282,Cold Storages,Kolhapur,"Mrs.Manisha R.Hendre,Kolhapur","R.S.276/40,Gokulshirgaon,Tq:Karveer",,,1000.0
1283,Cold Storages,Kolhapur,N T Patil VKS,Shirol,,,234.0
1284,Cold Storages,Kolhapur,"Nagari Vesa Sahakari Sanstha,Mz:Nagari",Kowad,,,116.0
1285,Cold Storages,Kolhapur,Narhari VKS,Waghurde,,,234.0
1286,Cold Storages,Kolhapur,Narsinh VKS,Padali,,,302.0
1287,Cold Storages,Kolhapur,Padmashri. Dr. D Y Patil Cooperative Sugar Factory Ltd,Dnyanshantinagar,,,6400.0
1288,Cold Storages,Kolhapur,Patil Balasaheb Jagonda,"Gat No.488, Mayur Phata, Sambhajinagar, Nagaon, Tal:Hatkangale, Dist: Kolhapur",,,600.0
1289,Cold Storages,Kolhapur,R R Patil VKS,Awali,,,300.0
1290,Cold Storages,Kolhapur,R.B. Patil Kisan Sahakari KVS,Gadmudhingi,,,969.0
1291,Cold Storages,Kolhapur,Rafiq Badshaha Momin,"Plot-43,Shiroli,Tq:Hatkangale",,,315.0
1292,Cold Storages,Kolhapur,Ramling VKS,Palechahuda,,,115.0
1293,Cold Storages,Kolhapur,Ratnakar Dhondiba Kolekar,"Gat No. 309, Hissa: Kasaba Kagal, Dist: Kolhapur",,,9350.0
1294,Cold Storages,Kolhapur,Ravalnath V.K.S.Seva Society Ltd.,"At Kadalage Bk, Tq.Chandgad,Kolhapur",,,202.98
1295,Cold Storages,Kolhapur,"Sadashiv Punjaba Mager,Hivarkheda",Tamgaon,,,500.0
1296,Cold Storages,Kolhapur,Sainik V.K.S. Seva Sanstha Ltd.,Takali,,,228.0
1297,Cold Storages,Kolhapur,Samruddhi Milk & Milk Product Ltd.,"Vhanali, Kagal",,,250.0
1298,Cold Storages,Kolhapur,Sarvodaya VKS,Kodali,,,505.0
1299,Cold Storages,Kolhapur,Shivaji V.K.S Seva Society Ltd. Mohare,"Mohare, Tq: Panhala",,,120.0
1300,Cold Storages,Kolhapur,Shree Ramanlal Jeevraj Doshi,Sadashivnagar,,,27235.8
1301,Cold Storages,Kolhapur,Shri Ambarish Sanjay Ghatge,"Plot-382,Mz:Vhanali,Tq:Kagal",,,255.075
1302,Cold Storages,Kolhapur,Shri Anil Nana Bhagbhage,"Gno-267,Rukadi,Tq:Hatkangale",,,705.775
1303,Cold Storages,Kolhapur,Shri Babaji Patil VKS,K. Tarale,,,252.0
1304,Cold Storages,Kolhapur,Shri Balasaheb Shankar Patil,"Gat No. 173, Halaswade, Tal: Karveer, Dist: Kolhapur",,,390.0
1305,Cold Storages,Kolhapur,Shri Datta V.K.S.Seva Sanstha Ltd.,Bhadgaon,,,266.0
1306,Cold Storages,Kolhapur,Shri Deepak Rangarao Patil,"Gat No. 240, A/P: Vathar, Tal: Katkanagale, Dist: Kolhapur",,,6051.0
1307,Cold Storages,Kolhapur,Shri Dnyaneshwar VKS,Shiye,,,100.0
1308,Cold Storages,Kolhapur,Shri Hanuman V.K.S.Seva Sanstha Ltd.,Boriwade,,,100.0
1309,Cold Storages,Kolhapur,"Shri Krishna V.K.S. Sty. Ltd.,Rajapurwadi","Cso-181,At Rajurwadi,Tq:Shirol",,,100.0
1310,Cold Storages,Kolhapur,Shri Lalith Sakalchand Gandhi,"A/P-Hitani,Tq:Gadhinglaj",,,1500.0
1311,Cold Storages,Kolhapur,"Shri Makai SSK Ltd.,Bhilarwadi","Godown-4,At Bhilarwadi,Taluk-Karmala",,,7666.6
1312,Cold Storages,Kolhapur,"Shri Pandurang VKS Seva Sanstha, Undarwadi","Undarwadi,",,,116.0
1313,Cold Storages,Kolhapur,Shri Samgonda Jingonda Patil,"Gat No. 418, Hirale, Tal: Hatkangale, Dist: Kolhapur",,,213.0
1314,Cold Storages,Kolhapur,Shri Shivputra Shankar Karambali,"Plot No.32,33,34 At Po.Uttur, Tal.Ajara",,,900.0
1315,Cold Storages,Kolhapur,Shri. Vasant Vishwanath Mahajan,Tandalwadi,,,553.0
1316,Cold Storages,Kolhapur,Shrikrishna VKS,Sablewadi,,,151.0
