,Type,District,Storage name,Address,Manager Name,Mobile No,Capacity in MT
1567,Cold Storages,Nanded,Ram Vithal Chidrawar,"Gut No.178, Jawahar Nagar, Bhaigaon Road,Tuppa,Tq.Nanded",,,2600.64
1568,Cold Storages,Nanded,Ravi Govindrao Tirmanwar,"R/O: Kinwat, Near Ramesh Talkies, Dist: Nanded",,,500.0
1569,Cold Storages,Nanded,Ravikar Warehouse ( Prop. Gangabai Gopalrao Gaikwad),"At Post: Paratpur, Tal: Mukhed, Dist: Nanded",,,1000.0
1570,Cold Storages,Nanded,Sai Vitthal Warehouse Degloor,"S.No. 408 A, Khanapur, Tal. Degloor",,,2080.0
1571,Cold Storages,Nanded,Sau Sushma Gangadhar Polawar & Sow Sunanda Gangadhar Pattewar,"Nanded-Hyderabad Road, At: Degaon, Tal: Naigaon (Kh), Dist: Nanded",,,3058.0
1572,Cold Storages,Nanded,Sau.Sunanda Gangadharrao Pattewar,"GPH No.669,At Naigaon,Tq.Naigaon(Kh)",,,287.222
1573,Cold Storages,Nanded,Shree Jagdamba Oil Industries,"D-92, MIDC, Nanded",,,2800.0
1574,Cold Storages,Nanded,Shri Ajay Shankar Chadawar,"Sr.No.25,At Kothari(Chi),Tq.Kinwat",,,989.472
1575,Cold Storages,Nanded,Shri Jai Shivshankar SSK Ltd.,"At Sheshnagar,Manjari,Tq.Mukhed",,,10012.8
1576,Cold Storages,Nanded,"Shri Krishna V.K.S. Sty. Ltd.,Rajapurwadi",Vasant Nagar,,,10000.0
1577,Cold Storages,Nanded,"Shri Rajaram Tippaji Naik,Nanded","Sno-381,Mz:Kurula,Tq:Kandhar",,,820.0
1578,Cold Storages,Nanded,Shri Rajendra Shankar Chadawar,"Sr.No.25,At Kothari(Chi),Tq.Kinwat",,,990.684
1579,Cold Storages,Nanded,Shri Ram Vithal Chidrawar,"Gno-178,Jawahar Nagar,Tuppa",,,13945.1
1580,Cold Storages,Nanded,Shri Sangmeshwar Agrowarehouse,"A/P-Paratpur,Tq.Mukhed",,,963.783
1581,Cold Storages,Nanded,Shri Sangmeshwar Warehouse,"Sno-96/D,Umardhari,Tq.Mukhed",,,3612.25
1582,Cold Storages,Nanded,Shri Santosh S. Palshikar,"S.No.351/5, A/P Himayatnagar (Kinwat Road), Tal. Himayatnagar, Dist. Nanded",,,1553.0
1583,Cold Storages,Nanded,Shri Subhash Vaijanathappa Saraf,"C-30,Gopalchowdi, Balirampur, Tal& Dist. Nanded",,,1896.0
1584,Cold Storages,Nanded,Shri Venkateshwara Agro Warehouse (Prop: Sow Archana P Vattamwar),"At: Paratpur (Mukramabad), Tal: Mukhed, Dist: Nanded",,,2000.0
1585,Cold Storages,Nanded,Shri. Uttam Kondji Kadam,Limbgaon,,,200.0
1586,Cold Storages,Nanded,Shubham Warehouse (Raju Pralhad Parsewar),"Gut No. 178, At Po: Tuppa, Tal:& Dist: Nanded",,,5406.68
1587,Cold Storages,Nanded,Shyamsundar Shivprasad Tela,Tuppa,,,2248.0
1588,Cold Storages,Nanded,Smt Shahista Parvin,"Mukhed, Tal: Mukhed, Dist: Nanded",,,1000.0
1589,Cold Storages,Nanded,Smt Shobha Uttam Chaudhari,"Mukhed, Tal: Mukhed, Dist: Nanded",,,1800.0
1590,Cold Storages,Nanded,Smt. Laxmibai Baburao Kagane,"At Bhavani Nagar, Post Kandhar, Tal Kandhar, Dist. Nanded",,,9525.0
1591,Cold Storages,Nanded,Smt. Laxmibai Jagannath Kamje,"R/O Berli (Kd), Tal. Mukhed, Dist. Nanded � 431 715",,,3200.0
1592,Cold Storages,Nanded,Smt. Radhabai Sheshrao Budruk,"Gut No.682, A/P Talani, Tal. Hadgaon, Dist. Nanded",,,266.0
1593,Cold Storages,Nanded,Smt. Sheela Ashok Kodgire,"Gut No. 76, At Somthana, Tal. Umri, Dist. Nanded",,,528.0
1594,Cold Storages,Nanded,Smt. Suganabai Hari Gire,"P.No. 3, Gat No. 42, Gopalchawdi, Tal & Dist. Nanded",,,552.0
1595,Cold Storages,Nanded,Sou. Shakuntalabai Uttamrao Kadam,Limbgaon,,,100.0
1596,Cold Storages,Nanded,Sow . Jamunabai Bhagirathji Baheti,"R/O Malegaon, Tal. Ardhapur, Dist. Nanded",,,1285.0
1597,Cold Storages,Nanded,Sow Sobha Umakant Rayewar,"At Post: Jalkot (Bk), Tal: Mukhed, Dist: Nanded",,,4000.0
1598,Cold Storages,Nanded,Sreenivasa Cold Storage And Ware House (Prop. Shri Sushil Shriram Medewar),"D-122,MIDC,Nanded",,,6615.0
1599,Cold Storages,Nanded,Tirumala Agro Warehouse (Prop. Smt Manisha Sanjay Kodgire),"S.No.28, Sharifabad, Patoda (Kh.), Tal Dharmabad, Dist. Nanded",,,1580.5
1600,Cold Storages,Nanded,Tirupati Agro Warehouse (Prop. Smt Rani Rajesh Kodgire),"S.No.28, Sharifabad, Patoda (Kh.), Tal Dharmabad, Dist. Nanded",,,1580.5
1601,Cold Storages,Nanded,Tirupati Warehouse (Prop. Yashpal Bhumreddy Kankante),"Gat No.83, At Sujayatpur, Post. Shahapur, Tal. Degloor, Dist. Nanded",,,2544.44
1602,Cold Storages,Nandurbar,Ms Kumar Cold Storage Prop Ashok Kantilal Jain,Mohide Shivar Shahada Dondaich Road Shahada,Shri Ashok Kantilal Jain,,1920.0
1603,Cold Storages,Nandurbar,Sanjay Ramesh Choudhary,"P-55-56,At Dhanora,Tq.Taloda,Nandurbar",,,360.852
1604,Cold Storages,Nandurbar,Shree Warehousing Pvt. Ltd.,Dokare,,,10000.0
1605,Cold Storages,Nandurbar,Shri Ambalal Nagin Patil,"Mno.573-4,A/P-Parivardhe,Tq:Shahada",,,701.254
1606,Cold Storages,Nandurbar,Shri Gopaldas S. Kothari,"P-14,MIDC Area Chikhali,Tq.Chikhali",,,1001.0
1607,Cold Storages,Nandurbar,Shri Ramakant Kashinath Patil,"Gno.573,At Shirud Digar,Tq.Shahada",,,355.614
1608,Cold Storages,Nandurbar,Shri Vijay Narottam Patil,"Sno-79/1A+B,At Dongargaon Road,Shahada",,,537.7
1609,Cold Storages,Nandurbar,Shri. Surupsing Naik,Navagaon,,,501.287
1610,Cold Storages,Nandurbar,Smt Kalpana Rajendra Patil,"S No. 445, A/P Anarad, Tal. Shahada, Dist. Nandurbar",,,976.0
1611,Cold Storages,Nashik,Bhaskar Murlidhar Bhamare Sompur VKSS,Sompur-Baglan,,,200.0
1612,Cold Storages,Nashik,Bhatgaon VKSS,Bhatgaon-Chandwad,,,108.0
1613,Cold Storages,Nashik,Chairman Late Ashokrao Bankar Nagari Sahakari Patsanstha Ltd,Ap Pimpalgaon B Tal Niphad Dist Nashik,,,965.0
1614,Cold Storages,Nashik,"Dwarkadhish Sakhar Karkhana Ltd,.","Factory Site At Shevarae,Taluk-Baglan",,,3840.0
1615,Cold Storages,Nashik,Gangurde Warehouse,"Gno-108,Mz:Jaulke,Taluk-Dindori",,,1947.78
1616,Cold Storages,Nashik,Gorakh Narsingrao Balkawade (Bhagur VKS Socy),Nasik,,,1140.0
1617,Cold Storages,Nashik,M/S Agarwal Warehousing,Vilcholi,,,3415.0
1618,Cold Storages,Nashik,M/S Anand Warehousing,"S No. 156, Mumbai Agra Highway (NH- 3), At: Jaulke (Ozar), Dist: Nasik",,,6709.3
1619,Cold Storages,Nashik,M/S Baphana Warehousing Pvt. Ltd,Jaulke,,,5320.0
1620,Cold Storages,Nashik,"M/S Baphana Warehousing Pvt. Ltd.,",Tilakwadi,,,4000.0
1621,Cold Storages,Nashik,"M/S Dwarakadhish Sakhar Karkhana Ltd.,",Sheware,,,
1622,Cold Storages,Nashik,M/S Falbag Va Bhajipal K V Sah. Sanstha,Andursul,,,200.0
1623,Cold Storages,Nashik,M/S Jondhale's Warehousing Complex,"Gat No.141/1 & 141/2, At Jaulke, Tal. Dindori, Dist. Nashik",,,3165.0
1624,Cold Storages,Nashik,M/S Palkhed VKS,Niphad,,,650.0
1625,Cold Storages,Nashik,M/S Pournima Warehousie,"Gno-570,Khambale,Tq:Igatpuri",,,3523.35
1626,Cold Storages,Nashik,M/S S. M Ratnaparkhi,Girnanagar,,,648.0
1627,Cold Storages,Nashik,M/S Siddhivinayak Warehousing & Agroprocessing,"Gno-30,Mohadi,Tq.Dindori",,,4232.25
1628,Cold Storages,Nashik,Maharashtra State Warehousiing Corporation,"Sinnar, Dist. Nashik",,,1874.47
1629,Cold Storages,Nashik,Maharashtra State Warehousiing Corporation (2 Units),"Plot No. E-9, MIDC Sinnar, Dist. Nashik",,,4800.0
1630,Cold Storages,Nashik,Mr Nilesh S Baphana,"At Po: Pimpalgaon (Baswant), Tal: Niphad, Dist: Nasik",,,1836.0
1631,Cold Storages,Nashik,Mr Omkar Ramgopal Dhut,"A P Wavi, Tal: Sinnar, Dist: Nasik",,,250.0
1632,Cold Storages,Nashik,Mr Sunil Kantilal Baphana,"A/P: Pimpalgaon- Baswant, Tal: Niphad, Dist: Nashik",,,12750.0
1633,Cold Storages,Nashik,Mr. Deepak Sukhdeo Pawar,"Sno-54/7P,At Bhaur,Tq.Deola (Kalwan)",,,239.17
1634,Cold Storages,Nashik,Mr. Nilesh Subhash Baphana,"Gno-102/D,At Jaulke Dindori",,,4596.06
1635,Cold Storages,Nashik,Mr. Paras L. Baphana & Mr. Nilesh S. Baphana,"Gno-102,At Jaulke Dindori,Nashik",,,18516.2
1636,Cold Storages,Nashik,Mr. Sunil Bebilal Sancheti,"PNo.11+12,Kalwan Tal.Audygik Vasahat,GNo.234,Manur,Tq. Kalwan",,,2048.45
1637,Cold Storages,Nashik,Mrs. Manorama Nivruti Avhad,Gangapur Road,,,824.0
1638,Cold Storages,Nashik,Mrs. Rekha Vijaykumar Kharate,Nandgaon,,,540.0
1639,Cold Storages,Nashik,Ms Sangale Agro Processing Pvt Ltd,Ugaon Road Niphad Dist Nashik,Shri Rajaram Nivrutti Sangale,,1100.0
1640,Cold Storages,Nashik,Ms Shree Ganesh Cold Storage,Ap Niphad Dist Nashik,Shri Balasaheb Kshirsagar,,2000.0
1641,Cold Storages,Nashik,Ms Vakratund Cold Storage Warehouse,,Shri Pritam Chopda,,3471.0
1642,Cold Storages,Nashik,Nandraj Packaging Individual Ustries,Tal.Malegoan,,,250.0
1643,Cold Storages,Nashik,Packhouse,,Manik Mahadu Kasar,,200.0
1644,Cold Storages,Nashik,Packhouse,,Kusum Pandit Gaikwad,,600.0
1645,Cold Storages,Nashik,"Sadashivrao Mandlik Kagal S.S.K. Ltd,",A/P- Datane,,,200.0
1646,Cold Storages,Nashik,Sancheti Warehousing,"C/O Shri Rajendra R Sancheti, At & Post: Jaulke, Tal: Dindori, Dist: Nashik",,,43130.0
1647,Cold Storages,Nashik,Sanjay Dattatray Tatar VKS,Sompur-Baglan,,,286.254
1648,Cold Storages,Nashik,Sau Nalini Devaji Jadhav,"S No. 349/3, At: Meshi, Tal: Deola, Dist: Nashik",,,294.0
1649,Cold Storages,Nashik,Sau.Hemlata Prakash Amalnerkar,"Gno-6/A,Matori,Tq.Nashik",,,960.02
1650,Cold Storages,Nashik,Sh. Amar Ramkisan Kalantri,Sinnar,,,1640.0
1651,Cold Storages,Nashik,Shedagawadi V.K.S. Seva Society Ltd.,Abhona,,,375.0
1652,Cold Storages,Nashik,Shri M K Kale,"GNo. 739/1,Andersul,Tq. Yeola",,,2380.11
1653,Cold Storages,Nashik,Shri Rajendra Laxminarayan Bhutada,"Gno-10/3,Wavi,Tq.Sinner",,,237.097
1654,Cold Storages,Nashik,Shri Syayji Narayan Pawar,A/P-Pimpalgoan,,,200.0
1655,Cold Storages,Nashik,Shri Vinod Manoharrao Wargantiwar,Kandane,,,100.0
1656,Cold Storages,Nashik,Shri. Dattatriya Dinkar Chavan,Nhavi,,,182.0
1657,Cold Storages,Nashik,Shri. Shantilal Jethanand Thakkar,Brhamnwade,,,1000.0
1658,Cold Storages,Nashik,"Smt Sarla Jugalkishor Agrawal, Smt. Manjusha Ramesh Joshi & Smt. Bhagwati Ramesh Motwani","Gat No.76/1A/2, At Malharwadi, Tal. Nandgaon, Dist. Nasik",,,989.171
1659,Cold Storages,Nashik,Smt. Kirti Nandlal Kothari,"A/P Bolthan, Tal. Nangaon, Dist. Nasik",,,700.0
1660,Cold Storages,Nashik,Smt. Vithabai Raghunath Dalvi,"At Lakhamapur,Dhandri Shivai,Tq.Satana,NAsik",,,398.163
1661,Cold Storages,Nashik,Sopan Baburao Thube,"Hanuman Nagar,Vinchur,Tq:Niphad",,,155.68
1662,Cold Storages,Nashik,Vasant Deoram Abhonkar,"Ringangaon,Erandol",,,117.0
1663,Cold Storages,Nashik,Vegetables & Fruit Cooperative Marketing Society Ltd.,"Gno-90A,At Lasalgaon,Tq:Niphad",,,891.0
1664,Cold Storages,Nashik,Waki,"Gat No. 389, A/P Waki, Tal. Igatpuri, Dist. Nashik",,,1382.4
1665,Cold Storages,Osmanabad,Dr. Babasaheb Ambedkar SSK Ltd.,Keshegaon,,,10000.0
1666,Cold Storages,Osmanabad,Dr. Babasaheb Ambedkar Sah.Sakhar Karkhana Ltd.,"Site At Arvindnagar,Keshegaon,Dist.Osmanabad",,,7666.6
1667,Cold Storages,Osmanabad,M/S Radhe Radhe Warehouses,"Plot No X 18, MIDC, Omerga, Dist. Osmanabad",,,12325.0
1668,Cold Storages,Osmanabad,Maharashtra State Warehousiing Corporation,"Survey No.207-1, APMC, Omarga, Dist. Osmanabad",,,2160.0
1669,Cold Storages,Osmanabad,Ms Natural Sugarand Allied Industry Ltd,,Shri Thombare Bhairavnath Bhagwanrao,,4450.0
1670,Cold Storages,Osmanabad,Natural Sugar & Allied Individual Ustries Ltd.,Ranjani,,,10000.0
1671,Cold Storages,Osmanabad,Shri Nilesh Chitaman Kadam,"Wanavathe, Donwat",,,1200.0
1672,Cold Storages,Osmanabad,Shri Prakarsh Ashok Sangave,"G.No.152,At Shiradhon,Tq.Kalamb",,,999.613
1673,Cold Storages,Parbhani,"Anant Ware Housing ( Prop. Sandeep Prakash Naladkar),Gangakhed","Gno-616,At Gangakhed,Tq.Gangakhed",,,
1674,Cold Storages,Parbhani,Anant Warehouse ( Prop. Sandeep Prakashrao Naladkar),"Plot No.474, Suralwadi, Tal: Gangakhed, Dist: Parbhani",,,1000.0
1675,Cold Storages,Parbhani,Balasaheb Haribhau Niras,"A/P Padegaon, Tal. Gangakhed, Dist. Parbhani",,,500.0
1676,Cold Storages,Parbhani,Balasaheb Shivrangrao Jagtap,"At Post: Dharmapuri, Tal Dist: Parbhani",,,1000.0
1677,Cold Storages,Parbhani,Bhagwan Marutrao Watane,Wazar,,,201.0
1678,Cold Storages,Parbhani,Bori V.K.S. Sah. Society Ltd.,Parwa,,,
1679,Cold Storages,Parbhani,Chandetarolewadi V.K.S. Sah. Society Ltd.,Parwa,,,1000.0
1680,Cold Storages,Parbhani,Durgeshwari Seeds Pvt. Ltd.,Brahmangaon,,,6516.0
1681,Cold Storages,Parbhani,Ganpat Bapurao Ghatol,"Gut No. 72 At Village Pimpalgaon (BA), Tal. Purna",,,250.0
1682,Cold Storages,Parbhani,Hariom Warehouse (Smt. Sagarbai Marotrao Kawale),"Gut No.146/3, At Gortha, Tal. Umri, Dist. Nanded",,,3106.01
1683,Cold Storages,Parbhani,Kamal Babanrao Bahirat,"At Post: Dharmapuri, Tal & Dist: Parbhani",,,1000.0
1684,Cold Storages,Parbhani,Kamalabai Omprakash Gattani,Dhanegaon,,,200.0
1685,Cold Storages,Parbhani,"Kawalgaon (New) VKSS Ltd.,Kawalgaon,Tq:Purna","Kawalgaon,Tq:purna",,,100.0
1686,Cold Storages,Parbhani,Laxmibai Mangeshrao Sawant,"At Post: Dharmapuri, Tal Dist: Parbhani",,,1000.0
1687,Cold Storages,Parbhani,Lohiya Rajkumar Chaganlal,"Village: Kanadkhed, Gut No. 180, Tal: Purna, Dist: Parbhani, Purna : 431 511",,,1000.0
1688,Cold Storages,Parbhani,M/S Dargad Warehouse,"Plot No. A-110,111 MIDC ,Jintur",,,2909.1
1689,Cold Storages,Parbhani,M/S Dargad Warehouse,"Plot No. A - 110, 111 In MIDC, Area Jintur, Tal: Jintur, Dist: Parbhani",,,1000.0
1690,Cold Storages,Parbhani,M/S Ganesh Agro Tech,Brahmangaon,,,4500.0
1691,Cold Storages,Parbhani,M/S Ganesh Individual Ustries,Jintur,,,500.0
1692,Cold Storages,Parbhani,M/S Shri Onkar Warehousing Co.,"Gno-49,A/P-Dharmapuri,Tq & Dist.",,,2700.86
1693,Cold Storages,Parbhani,M/S Shriram Agro Warehouse (Prop: Sow Supriya Gajanan Narlewar),"At: Palam, S No. 180/2(B), Tal: Palam, Dist: Parbhani",,,1000.0
1694,Cold Storages,Parbhani,Maharashtra State Warehousing Corporation,Manwat,,,3518.76
1695,Cold Storages,Parbhani,Mahesh Warehousing (Prop. Pankaj Mangilal Bhandari),"S. No.88/1, Gangakhed, Dist. Parbhani",,,1666.0
1696,Cold Storages,Parbhani,Mangesh Bhagwantrao Sawant,"At Post: Dharmapuri, Tal, Dist: Parbhani",,,1000.0
1697,Cold Storages,Parbhani,Mr. Kanchan T.Katruwar,"Gno-59,At Kaudgaon,Tq & Distr-Parbhani",,,1924.72
1698,Cold Storages,Parbhani,Mr. Saheb Baliramji Bhosale,"Gno-213,At Suhagan,Tq.Purna",,,523.8
1699,Cold Storages,Parbhani,Mr. Shamsundar P. Murkya,"Plot-C-42,MIDC,PArbhani",,,2017.78
1700,Cold Storages,Parbhani,Mr. Vinaykumar G. Banthiya,"Sno-236,Mz:Parwa,Tq:PArbhani",,,996.117
1701,Cold Storages,Parbhani,Mrs Veena Shivnarayan Baheti,"Gut No. 47, At Post: Kupsa, Tal: Selu, Dist: Parbhani - 431503",,,6464.0
1702,Cold Storages,Parbhani,Mrs. Minakshi Nandkishor Sarda,"A/P-Brahmangaon,Tq. & Dist.Parbhani",,,6024.86
1703,Cold Storages,Parbhani,Mrs. Sushama Surendra Kumar Banthya,"Sno-180(P),At & Tq:Jintur",,,929.88
1704,Cold Storages,Parbhani,Nanda Ashok Shinde,"At Post: Dharmapuri, Tal Dist: Parbhani",,,1000.0
1705,Cold Storages,Parbhani,Nanda Ashok Shinde (Godown II),"At Post:Dharmapuri, Tal Dist: Parbhani",,,1000.0
1706,Cold Storages,Parbhani,Nitin Dogarmal Gandhi,"At/Post Bori, Tal. Jintur",,,202.0
1707,Cold Storages,Parbhani,Prasad Panditrao Deshmukh,"At: Pedgaon, Tal & Dist: Parbhani",,,250.0
1708,Cold Storages,Parbhani,Prasad Pralhadrao Chapke,"G No. 74 At & Post: Katneshwar, Tal: Purna, Dist: Parbhani",,,250.0
1709,Cold Storages,Parbhani,Rajrajeshwar Agro Warehouse (Smt Jyoti Nandkumar Bijamwar),"M/S Raj Rajeshwara Agro Warehouse, T Bodhadid, Tal. Kinwat,",,,1000.0
1710,Cold Storages,Parbhani,Rokadeshwar Warehouse (Prop.Mr. Pannalal B. Murkya),"Plot -A-34,MIDC,Parbhani",,,7315.85
1711,Cold Storages,Parbhani,Rupali Harish Katruwar,Kaudgaon,,,1000.0
1712,Cold Storages,Parbhani,Sanjay Babarao Deshmukh & Gajanan Babarao Deshmukh,"Gat. No. 192, At Sapatgaon, Tal. Sengaon",,,1204.0
1713,Cold Storages,Parbhani,Sau Sangita Bhagvanrao Deshmukh,"R/O: Shahapur, Tal Dist: Parbhani",,,300.0
1714,Cold Storages,Parbhani,Sau Sugandha Uday Katruwar,Kaudgaon,,,1000.0
1715,Cold Storages,Parbhani,Sau. Mamta Laxmanrao Jadhav,Bori,,,100.0
1716,Cold Storages,Parbhani,Sau.Shakuntalabai Gopal Ajmera,"Sno-75,Mz:Adgaon Lasina,Tq.Purna",,,550.0
1717,Cold Storages,Parbhani,Sau.Sushama S. Bathiya,"Sno-236,At Parwa,Tq.Parbhani",,,727.074
1718,Cold Storages,Parbhani,Sawji Warehouse (Prop. Prasant Sundarlal Sawaji (Kalamkar)),"At Gat No.216 K, Jintur, Tal: Jintur, Dist: Parbhani",,,1000.0
1719,Cold Storages,Parbhani,Sh. Dnyanesh Ramchandra Katruwar,Kaudgaon,,,1000.0
1720,Cold Storages,Parbhani,Sh. Ganesh Ramchandra Katruwar,Kaudgaon,,,1000.0
1721,Cold Storages,Parbhani,Sh. Harish Kanchan Katruwar,Kaudgaon,,,1000.0
1722,Cold Storages,Parbhani,Sh. Maroti Pandharinath Tare,"Kolha, Manwt",,,101.0
1723,Cold Storages,Parbhani,Sh. Ramchandra Trimbak Katruwar,Kaudgaon,,,1000.0
1724,Cold Storages,Parbhani,Sh. Uday Kanchan Katruwar,Kaudgaon,,,1000.0
1725,Cold Storages,Parbhani,"Shri Abhijeet Baburao Solunke,Hasnapur","Gut No-1,At Hasnapur,Distt. Parbhani",,,1613.59
1726,Cold Storages,Parbhani,Shri Ashok Kanahyalal Sancheti,Jintur,,,500.0
1727,Cold Storages,Parbhani,Shri Bhalchandra Rajaram Rudrawar,"Gno-74,At Parwa,Tq. & Dis. Parbhani",,,992.548
1728,Cold Storages,Parbhani,Shri Bhosale Daulatrao Baliramji,"Village: Kanadkhed, Gut No. 180, Tal: Purna, Dist: Parbhani, Purna - 431 511",,,1000.0
1729,Cold Storages,Parbhani,Shri Chitlange Vishal Laxminarayan,"Village: Kanadkhed, Gut No. 180, Tal: Purna, Dist: Parbhani, Purna - 431 512",,,1000.0
1730,Cold Storages,Parbhani,Shri Dilip Manikrao Murkute,"Gunt No.166, Village Narsapur, Taluk & Dist: Parbhani",,,987.0
1731,Cold Storages,Parbhani,Shri Ganesh Shivaji Mukkawar,"Gno-62,Brahamangaon,Tq.Parbhani",,,996.117
1732,Cold Storages,Parbhani,Shri Gangadhar Wamanrao Kadam,"Gno-65, At Mud,Taluk-Jintur",,,768.6
1733,Cold Storages,Parbhani,Shri Govind Shivaji Mukkawar,"Gno-62,Brahamangaon,Tq.Parbhani",,,996.117
1734,Cold Storages,Parbhani,Shri Nitin Vijaykumar Katruwar (Prop. Natraj Warehousing),"Gut.No.450/B At Manwath,Tq. Mnwath,",,,2879.75
1735,Cold Storages,Parbhani,Shri Pandurang Dagdoji Bansode,"G.No.199,At Pimpalgaon(Ba),Tq.Purna",,,250.728
1736,Cold Storages,Parbhani,Shri Ramchandra Trimbakrao Katruwar,"Gno-335,Mz T Tq:Manwat",,,2354.97
1737,Cold Storages,Parbhani,"Shri Sampat Mahalle,Kalambe Mahali",A/P-Aasola,,,300.0
1738,Cold Storages,Parbhani,Shri Shrikant Vaijnath Pratapwar,"Gno-228,Parwa,Tq. & Dist.Parbhani",,,996.117
1739,Cold Storages,Parbhani,Shri Suhas Ganpatrao Deshmukh,"Pedgaon, Tal: & Dist: Parbhani",,,200.0
1740,Cold Storages,Parbhani,Shri Swapnil Shrikant Pratapwar,"Gno-228,Parwa,Tq. & Dist.Parbhani",,,996.117
1741,Cold Storages,Parbhani,Shri. Govardhan Tarachand Sharma,Adgaon,,,100.0
1742,Cold Storages,Parbhani,Shri. Prakash Balasaheb Deshmukh,Simangaon,,,250.0
1743,Cold Storages,Parbhani,Shri. Ramchandra Balasaheb Deshmukh,Marwadi,,,100.0
1744,Cold Storages,Parbhani,Shri. Saheb Babarao Dhage,Chatori,,,100.0
1745,Cold Storages,Parbhani,"Shubhangi Sanjay Pund,Bazar Savangi",A/P-Aasola,,,300.0
1746,Cold Storages,Parbhani,Smt Mandakini D Bhombe,"A/P Manthala, Tal. Jintur, Dist. Parbhani",,,1000.0
1747,Cold Storages,Parbhani,Smt Rahibai Amrutrao Shinde,"R/O Brahmangaon, Tal & Dist. Parbhani",,,1000.0
1748,Cold Storages,Parbhani,Smt Rupali Harish Katruwar,"At Po: Kaudgaon, Tal & Dist: Parbhani",,,1000.0
1749,Cold Storages,Parbhani,Smt. Archana M. Rudrawar,"A/P Vanisangam, Tal. Sonpeth, Dist. Parbhani",,,1000.0
1750,Cold Storages,Parbhani,Smt. Jijabai Digambar Deode,"Gut No 408, Sadegaon , Tal & Dist. Parbhani",,,300.0
1751,Cold Storages,Parbhani,Smt. Leeladevi Girdharilal Toshniwal,"Gat No.287, At Warud, Dist. Parbhani",,,752.4
1752,Cold Storages,Parbhani,Smt. Madhuri Gangadhar Kadam,"Gno-65,Mz:Mud,Taluk-Jintur",,,768.6
1753,Cold Storages,Parbhani,Smt. Sanjivani Sunil Choudhary,"Survey No.593, Gangakhed-Parbhani Road, Gangakhed",,,1000.0
1754,Cold Storages,Parbhani,Smt. Shailaja Dattatraya Gaikwad,"Gut No.156. Village Parva, Tal. & Dist Parbhani",,,2000.0
1755,Cold Storages,Parbhani,Smt. Sitadevi Brijgopal Toshniwal,"Gat No.289, At Warud, Tal. Jintur, Dist. Parbhani",,,802.23
1756,Cold Storages,Parbhani,Smt. Sunanda Ramakant Deokar,"R/O Bhogao Devi. Tal. Jintur, Dist. Parbhani",,,222.566
1757,Cold Storages,Parbhani,Smt. Surekha Devidasrao Chaudari,Wassa,,,100.0
1758,Cold Storages,Parbhani,Smt. Vimaltai Suresh Deshmukh (Godown 2),"GUT No 36,AT POST DHARMAPURI,TAL.PARBHANI DIST. PARBHANI",,,995.54
1759,Cold Storages,Parbhani,Sou Neha Ganeshrao Deshmukh,"AT; Zari, Tal & Dist:Parbhani",,,1000.0
1760,Cold Storages,Parbhani,Sou Rajashri Vinay Bhatiya,"S.No. 236, Village Parwa, Tal & Dist : Parbhani",,,1000.0
1761,Cold Storages,Parbhani,Sou.Samrabai Vishwanath Niras,"Gno-179,Shankarwadi,Tq:Gangakhed",,,669.78
1762,Cold Storages,Parbhani,Sou.Ushatai Vijaykumar Katruwar,"Sno-450B,Mz:Manwath,Tq.Manwath",,,1863.99
1763,Cold Storages,Parbhani,Sow. Suman G. Banthia,"A/P Parwa,",,,1904.4
1764,Cold Storages,Parbhani,Sow. Vimalbai Bhalchandra Rudrawar,"Gno-74,At Parwa,Tq. & Dis. Parbhani",,,992.548
1765,Cold Storages,Parbhani,Sri Surendra Gendmalji Bathiya,"Survey No. 180, Jalna Road, Jintur",,,996.0
1766,Cold Storages,Parbhani,Suhas Ganpatrao Deshmukh,AT PEDGAON,,,200.0
1767,Cold Storages,Parbhani,Suryakant Palasaheb Choudhary,"S No. 348, At: Buralwadi, Tal: Gangakhed, Dist: Parbhani",,,166.022
1768,Cold Storages,Parbhani,"Taterao Uttamrao Kadam, At H.No.3-6-50, Nehru Road, Purna, Tal. Purna, Dist. Parbhani","Shivaji Road, Purna, Tal. Purna, Dist. Parbhani",,,1004.4
1769,Cold Storages,Parbhani,Vimaltai Sureshrao Deshmukh (Godown 1),"At Post: Dharmapuri, Tal & Dist: Parbhani",,,1000.0
1770,Cold Storages,Pune,Aditya Warehousing,"Loni, Kalbhor",,,3800.0
1771,Cold Storages,Pune,Anuraj Transport,"A/P : Yavat, Tal: Daund, Dist: Pune",,,6017.0
1772,Cold Storages,Pune,Babhulsar V.K.S. Seva Sanstha Ltd.,"Milket No. 233, At : Babhulsar,Tq:Shirur",,,250.0
1773,Cold Storages,Pune,Baramati Agro Ltd.,"A/P-Pimpali,Tq.Baramati,Pune",,,3424.78
1774,Cold Storages,Pune,Baramati Cattle Feeds Pvt. Ltd.,Baramati,,,3415.0
1775,Cold Storages,Pune,Baramati Tal.KVS,Baramati,,,354.0
1776,Cold Storages,Pune,Bhima Shankar Sah.Sakhar Karkhana Ltd.,"At Dattatrayanagar,Pargaon,Tq.Ambegaon",,,7847.47
1777,Cold Storages,Pune,Dattatraya Sambhaji Dhangekar,"Gat No. 1364,Wagholi Gaon,Tal. Haveli,Nagar Road,",,,2333.66
1778,Cold Storages,Pune,Digambar Shankarrao Tompe,"Rajgruha, Pabal Road, Shikrapur, Tal: Shirur, Dist: Pune",,,988.84
1779,Cold Storages,Pune,Ganapat Eknath Kalbhor,"Kadamvak Wasti, Tal Haveli",,,4000.0
1780,Cold Storages,Pune,Kale Ravindra Shankar,"At. Post Malegaon KH, Tal. Baramati",,,11000.0
1781,Cold Storages,Pune,Karandi VKSS,Karandi,,,111.0
1782,Cold Storages,Pune,"M/S APMC Segaon Submarket, Matagaon",Matargaon,,,100.0
1783,Cold Storages,Pune,M/S Baramati Agro Ltd.,Pimpali,,,1976.56
1784,Cold Storages,Pune,M/S Baramati Agro Ltd. (Godown I I),"Gut No 97, Shetphalgade, Tal. Indapur, Dist. Pune",,,11692.3
1785,Cold Storages,Pune,M/S Baramati Agro Ltd. (Godown I),"Gut No 97, Shetphalgade, Tal. Indapur, Dist. Pune",,,16312.0
1786,Cold Storages,Pune,M/S Baramati Cattlefeeds Pvt. Ltd.,"E-249, MIDC, Baramati Pune",,,5069.0
1787,Cold Storages,Pune,M/S Gauri Agro Warehouse,"At Gat No. 07, At: & Po: Chimbli, Tal: Khed, Dist: Pune",,,9013.0
1788,Cold Storages,Pune,M/S Gauri Warehouse,Kuruli,,,1675.0
1789,Cold Storages,Pune,M/S Gauri Warehousing Company,"Gat No. 147, At & Po. Kuruli, Tal. Khed,",,,8160.0
1790,Cold Storages,Pune,M/S Gauri Warehousing Corp.,"Gno-148,A/P-Kuruli,Tq.Khed,Dist.Pune",,,9735.0
1791,Cold Storages,Pune,M/S Individual Apur Taluka Phalotpadak KVS,Individual Apur,,,250.0
1792,Cold Storages,Pune,M/S Khomanewadi VKS Seva Sanstha,Khomanewadi,,,289.0
1793,Cold Storages,Pune,M/S Laxmi Warehouse,Hinjewadi,,,180.0
1794,Cold Storages,Pune,M/S M G Kalkhaire & Mr. R G Sawant,"Karanjepul, Baramati",,,430.341
1795,Cold Storages,Pune,M/S Ramling Ware House (Prop: Smt Lata Sunil Mahajan & Smt Sunanda Balasaheb Mahajan),"Gut No. 2241 & 2242, Chelpimpalgaon Village, Khed Tal, Dist: Pune",,,5714.0
1796,Cold Storages,Pune,M/S S.M.Group-A/P-Wadaki,"Gut No.1357 At Wadaki,Tq:Haveli",,,5040.0
1797,Cold Storages,Pune,M/S Sacha Saudha Warehousing,Autade Handewadi,,,869.0
1798,Cold Storages,Pune,M/S Salakki Warehouse II,"Gut No. 2/2, Mouje: Mulegaon Tanda, Hyderabad Road, Solapur, Tal: South Solapur, Dist: Solapur",,,6691.0
1799,Cold Storages,Pune,"M/S Shikrapur VKS Ltd.,",Shikrapur,,,100.0
1800,Cold Storages,Pune,"M/S Shreenath Warehousing Co.,Fursungi,Tq:Haveli","Sr.No.161,Fursungi,Tq:Haveli",,,8818.2
1801,Cold Storages,Pune,M/S Swami Samarth Warehouse,Tothawade,,,261.0
1802,Cold Storages,Pune,M/S. Gauri Warehouse,"At Post Kuruli, Tal.Khed, Dist. Pune",,,6200.0
1803,Cold Storages,Pune,MS Iceage Cold Storage,,Shri Dhanraj Dnyaneshwar Moze,,1411.0
1804,Cold Storages,Pune,Maharashtra State Warehousiing Corporation,"Chincholi, Dist. Solapur",,,3177.42
1805,Cold Storages,Pune,Maharashtra State Warehousiing Corporation,"Akola, Dist. Akola",,,3198.15
1806,Cold Storages,Pune,Maharashtra State Warehousiing Corporation,"Wai, Dist. Satara",,,1874.47
1807,Cold Storages,Pune,Maharashtra State Warehousiing Corporation,"Raver, Dist. Jalgaon",,,1874.47
1808,Cold Storages,Pune,Maharashtra State Warehousiing Corporation,"Pachora, Dist. Jalgaon",,,1808.61
1809,Cold Storages,Pune,Maharashtra State Warehousiing Corporation,"Ozar, Dist. Nashik",,,1903.44
1810,Cold Storages,Pune,Maharashtra State Warehousiing Corporation,"Butibori MIDC, Dist. Nagpur",,,1808.61
1811,Cold Storages,Pune,Maharashtra State Warehousiing Corporation,"Hinghanghat, Dist. Wardha",,,3079.83
1812,Cold Storages,Pune,Maharashtra State Warehousing Corporation,"Midc,Plot-B-1,Chandur Rly",,,1759.38
1813,Cold Storages,Pune,Maharashtra State Warehousing Corporation,"MIDC,Plot-C-4,Baramati",,,3000.0
1814,Cold Storages,Pune,Maharashtra State Warehousing Corporation,"APMC,Nandgaon",,,1759.38
1815,Cold Storages,Pune,Maharashtra State Warehousing Corporation,"At APMC (Shivleela Market), Indapur Area, Indapur Taluk, Dist. Pune",,,1808.61
1816,Cold Storages,Pune,Maharashtra State Warehousing Corporation,"Plot Survey No.46, Gat No.93, Khamgaon (Warkhed), Tal. Khamgaon, Dist. Buldana",,,1812.16
1817,Cold Storages,Pune,Maharashtra State Warehousing Corporation,"MIDC, Plot No. H-105, Ambad, Tal. Ambad, Dist. Nashik",,,1110.88
1818,Cold Storages,Pune,Mr Dhiraj Dharamchand Chhajed,"Gat No. 125, Village : Rohakal, Tal: Khed, Dist: Pune - 410 505",,,9600.0
1819,Cold Storages,Pune,Mr Suresh Baburao Bhadale,"At Post: Wagholi, Tal: Haveli, Dist: Pune",,,7800.0
