,Type,District,Storage name,Address,Manager Name,Mobile No,Capacity in MT
525,Cold Storages,Aurangabad,Shri Namdeo Vitthal Deotkar,"Gat No. 12, At/Post: Maliwada, Tal: Dist: Aurangabad , PIN: 431002",,,573.53
526,Cold Storages,Aurangabad,Shri Poonamchand Jaganlal Agrawal,"Sr.No.180/2(Part),V/P & Tq.Kannad",,,1001.18
527,Cold Storages,Aurangabad,"Shri Punamchand Ramsingh Chavan,A/P-Abdulpur(Tanda)","Gut No.160,Tq:Khultabad",,,600.0
528,Cold Storages,Aurangabad,Shri Pundalik Kausaji Shejul & 2 Others,"Gno-46,At Naigaon,Tq:Gangapur",,,5603.02
529,Cold Storages,Aurangabad,Shri Rangnath Rajaram Wagale & Smt. Purnabai Rangnath Wagale,"Plot-74,Musthafabad,Tq.Gangapur",,,211.598
530,Cold Storages,Aurangabad,Shri Raosaheb Ganpat Wagh,"G.No.157,At Khullod,Tq.Sillod",,,199.95
531,Cold Storages,Aurangabad,Shri Ravindra Someshwar Jawalkar,"At Gut No. 180, At: Kannad, Tal: Kannad, DIst: Aurangabad",,,1000.0
532,Cold Storages,Aurangabad,Shri Ravsaheb Suryabhan Nage,"Sno-152/1,Mz:Sarai,Tq:Khultabad",,,207.363
533,Cold Storages,Aurangabad,Shri Sandeep Ashokkumar Patni,"At Gat No. 104, Sillod � Bhokardan Road, At: Pimpri, Taluka: Sillod, Dist: Aurangabad",,,1000.0
534,Cold Storages,Aurangabad,"Shri Sayyad Siraj Sayad Ahemad, Fulambri","Sno-572,At & Tq: Fulambri",,,500.0
535,Cold Storages,Aurangabad,Shri Sayyad Younus Sayyad Ismail,"Sr.No.93,At Dongargaon,Tq.Sillod",,,1019.07
536,Cold Storages,Aurangabad,"Shri Shaikh Samad Shekh Husain,A/P-Kanshil","Gno-170,Mz:Kanshil,Tq:Khultabad",,,500.0
537,Cold Storages,Aurangabad,Shri Shivaji Valmiki Bachate,Aurangabad,,,995.0
538,Cold Storages,Aurangabad,Shri Subhash Laxman Thorat,"Gno-2,Mushtafabad(Ambegaon),Tq.Gangapur",,,
539,Cold Storages,Aurangabad,Shri Sudam Pandurang Raut,"Plot-717,Mz:Pandharpur,Tq:&Dist.Aura.",,,456.306
540,Cold Storages,Aurangabad,Shri Taru Appa Mete,"At Post: Chauka, Tal: Phulambri, Dist: Aurangabad",,,999.18
541,Cold Storages,Aurangabad,"Shri Thakaji Taterao Pund,A/P-Bajar Sawangi","Gut No.469,A/P-Bajar Sawangi,Tq:khu.",,,550.0
542,Cold Storages,Aurangabad,"Shri Uttam Govingrao Lahane,A/P-Sherudi(Budruk)","Gut No.414,Tq:Fulambri",,,600.0
543,Cold Storages,Aurangabad,Shri Vijay Dilsukh Gangwal,"Gno-260,A/P-Pishor,Tq.Kannad",,,999.936
544,Cold Storages,Aurangabad,Shri Vishnu Sajaba Katkar,"G.No.931,At Bazar Sawangi,Tq.Khultabad",,,470.81
545,Cold Storages,Aurangabad,Shri Vishwanath Madhavrao Torate,"Gno-369,Dongargaon,Tq;Fulambri",,,527.04
546,Cold Storages,Aurangabad,Shri Vishwas Shamrao Solunke,"G.No.278,A/P-Nagapur,Tq.Sillod",,,999.18
547,Cold Storages,Aurangabad,Shri. Ambadas G. Gulwe,Sardi,,,105.759
548,Cold Storages,Aurangabad,Shri. Devidas P Lokhande,Mandna,,,247.667
549,Cold Storages,Aurangabad,Shri. Kashinath Namdeo Mahajan,Bharadi,,,200.0
550,Cold Storages,Aurangabad,Shri. Sitaram M. Wagh,Khullod,,,127.347
551,Cold Storages,Aurangabad,Shri. Tukaram M Gauhane,Badwad,,,105.759
552,Cold Storages,Aurangabad,Shri.RavIndividual Ra S Jaiswal,Bhardi,,,189.0
553,Cold Storages,Aurangabad,"Shubhangi Sanjay Pund,Bazar Savangi","Gutno934,Bazar Sawangi,Tq:Khultabad.",,,500.0
554,Cold Storages,Aurangabad,Shyalabai Machhindra Gyake,"Gat No. 179, At Post: Khamgaon, Tal: Kannad, Dist: Aurangabad",,,1000.0
555,Cold Storages,Aurangabad,Smt Kumudini Sudhir Ghuge,"At: Banshendra, Tal: Kannad, Dist: Aurangabad",,,1000.0
556,Cold Storages,Aurangabad,Smt Shahanabai Yusufkhan Pathan,"At Gat No. 124, Sillod � Kannad Road, At: Borgaon Bajar, Tal: Aurangabad",,,1000.0
557,Cold Storages,Aurangabad,Smt Shantabai Vithal Ghuge,"Gut No. 124, At: Devpul, Tal: Kannad, Dist: Aurangabad",,,278.0
558,Cold Storages,Aurangabad,Smt Yamunabai Kakasaheb Rakade,"At Gat No. 362, Bharadi, Taluka: Bharadi, Dist: Aurangabad",,,1000.0
559,Cold Storages,Aurangabad,Smt. Archana Sudham Ghavate,"Gut No.100, A/P Satana, Tal. & Dist. Aurangabad",,,999.936
560,Cold Storages,Aurangabad,Smt. Kadubai Karbhari Rawate,"At Gut No.109, Sultanabad, Tal.Gangapur, Dist. Aurangabad",,,1000.0
561,Cold Storages,Aurangabad,Smt. Kaushalyabai Bhimrao Khandagale,"Gat No. 29, At Post Nirgudi (Bk.), Tal. Khultabad, District Aurangabad.",,,504.0
562,Cold Storages,Aurangabad,Smt. Latabai Annasaheb Wagh,"Gat No. 176. At Post Khullod, Tal. Sillod",,,150.0
563,Cold Storages,Aurangabad,Smt. Malanbai Shamrao Gayake,"Gut No.141, A/P Ghanegaon, Tal. Gangapur, Dist. Aurangabad",,,999.936
564,Cold Storages,Aurangabad,Smt. Meenabai Dyneshwar Kakade,"GAT No186 Anvi-Bhokaradan Road At Dhanora,Tal Anvi Dist Aurangabad",,,500.0
565,Cold Storages,Aurangabad,Smt. Meerabai Hari Pawar,"At Gut No.16, Pedakwadi, Tal. Kannad, Dist. Aurangabad",,,1000.0
566,Cold Storages,Aurangabad,Smt. Nanubai Vishwanath Khandagale,"A/P Nirgudi (B), Tal. Khulthabad, Dist. Aurangabad",,,504.0
567,Cold Storages,Aurangabad,Smt. Savitribai Prabhat Boldhane,Kawitheda,,,200.0
568,Cold Storages,Aurangabad,Smt. Shakuntalabai Abarao Sonawane,Aurangabad,,,995.0
569,Cold Storages,Aurangabad,Smt. Sharada Gopal Agrawal,Bhaigaon,,,500.0
570,Cold Storages,Aurangabad,Smt. Sumitrabai Kashinath Janjal,"Milkat No.428, Grampanchayat S.No.429, Sillod-Chinchpure Road, At Chinchpure, Post Mangrool, Tal. Sillod, Dist. Aurangabad",,,500.0
571,Cold Storages,Aurangabad,Smt. Tejaswini Govind Bhoruka,"Gut No. 61, At Post Vithalpur, Tal. Kannad, Dist. Aurangabad",,,1004.0
572,Cold Storages,Aurangabad,Sopan Sheku Tayde,"At.Post: Chincholi (Limbaji), Tal: Kannad, Dist: Aurangabad",,,1000.0
573,Cold Storages,Aurangabad,Sow Surekha Ashok Pawar,"Gat No. 327, At Post: Chapaner, Tal: Kannad, Dist: Aurangabad",,,1000.0
574,Cold Storages,Aurangabad,"Sow.Asrabai Ramrao Jagtap,A/P-Shelgaon","Gut No.27,Tq:Phulmbri",,,700.0
575,Cold Storages,Aurangabad,Subhash H.Bohara,Ambada,,,300.0
576,Cold Storages,Aurangabad,Sudhakar Gangadhar Thombre,"Gno-236,A/P-Viramgaoan,Tq:Khultabad",,,999.936
577,Cold Storages,Aurangabad,Sunil Bhagaji Kolhe,"At.Post: Karanjkheda, Tal: Kannad, Dist: Aurangabad",,,1000.0
578,Cold Storages,Aurangabad,Sunil Punjaba Mohite,"Gat No. 09, At Post: Rel, Tal: Kannad, Dist: Aurangabad",,,1000.0
579,Cold Storages,Aurangabad,Sunil Sundarlal Patni,"At Post; Aland, Tal: Phulambri, Dist: Aurangabad",,,1000.0
580,Cold Storages,Aurangabad,Supdabai Raibhan Katkar,"Gat No 470, At Post: Khamgaon, Tal: Phulambri, Dist: Aurangabad",,,1000.0
581,Cold Storages,Aurangabad,"Surekha Pundalik Jadhav,Wanegaon","Sr.No.199,Wanegaon,Tq:Phulambri",,,500.0
582,Cold Storages,Aurangabad,Suresh Zumberlal Gandhi,"Anand Krishi, Seva Kendra, Main Road, Gangapur, Tal: Gangapur, Dist: Aurangabad",,,1000.0
583,Cold Storages,Aurangabad,Tarabai Kasturchand Patodi,"Gat No. 300, At Post; Galleborgaon, Tal: Khultabad, Dist: Aurangabad",,,1000.0
584,Cold Storages,Aurangabad,"Tejaram Sampath Killare,Shirodi","Gutno88,Janefal,Tq:Phulambri",,,500.0
585,Cold Storages,Aurangabad,Tolabai Narayan Ghuge,"Gat No. 226, At Post: Mahegaon, Al: Kannad, Dist: Aurangabad",,,1000.0
586,Cold Storages,Aurangabad,"Trimbak Kondiba Tekale,Pimpalgaon",Gutno22at PimpalgaonTq:Phulambri,,,500.0
587,Cold Storages,Aurangabad,Tukaram Sakharam Khomne,"Gat No. 35, Post: Bharadi, Tal: Sillod, Dist; Aurangabad",,,1000.0
588,Cold Storages,Aurangabad,Tulasabai Ramdas Avhad,"Gat No. 235, At Post: Mehegaon, Tal: Kannad, Dist: Aurangabad",,,600.0
589,Cold Storages,Aurangabad,Tulsabai Kachru Thengde,"Gat No. 442, At Post: Palaswadi, Tal: Khultabad, Dist: Aurangabad",,,1000.0
590,Cold Storages,Aurangabad,Uttam Namdeo Kathar,"Gat No.36, At Post: Pimparkheda, Tal: Kannad, Dist: Aurangabad",,,1000.0
591,Cold Storages,Aurangabad,Venubai Asaram Bhumre,"Gut No. 241, At Post: Pachod, Tal: Palthan, Dist: Aurangabad",,,1000.0
592,Cold Storages,Aurangabad,Vijay Bhanudas Jadhav,"Gat No.165, At Post : Kolambi, Tal: Kannad, Dist: Aurangabad",,,1000.0
593,Cold Storages,Aurangabad,Vilas Bhimrao Aavakale,"Gno-236,A/P-Viramgaoan,Tq:Khultabad",,,999.936
594,Cold Storages,Aurangabad,Vimalbai Vishwanath Bodkhe,"Gat No. 511, At Post: Galleborgaon, Tal: Khultabad, Dist: Aurangabad",,,1000.0
595,Cold Storages,Beed,Anurag Ware Housing & Agro Processing,Gevrai,,,2516.31
596,Cold Storages,Beed,Dr. V.V.Patil SSK Ltd.,"At Ashoknagar,Tq. Kaij",,,6418.78
597,Cold Storages,Beed,"Gokhali V.K.S. Seva Socy Ltd.,","Gokhali Tal. Phaltan, Dist. Satara",,,104.0
598,Cold Storages,Beed,Kisan Warehouse,Tokwadi,,,2325.0
599,Cold Storages,Beed,LalitKumar Ramniwas Bajaj,Waghala,,,1000.0
600,Cold Storages,Beed,M/S Jay Kedarnath Agro Services (Smt Manjusha Namdeo Wakode & Others 3),"At Hadsami Gram Panchayat, Tal. Hadgaon, Dist. Nanded � 431 743",,,1000.0
601,Cold Storages,Beed,M/S Kisan Agencies,Tokwadi,,,2325.0
602,Cold Storages,Beed,M/S Kisan Warehouse,"At: Shirsala, Tal: Parli-Vaijanath, Dist: Beed",,,280.0
603,Cold Storages,Beed,"M/S Renuka Warehousing & Agroprocessing,Devgaon","Sr.No-274,Devgaon,Tq:Kaij",,,3400.0
604,Cold Storages,Beed,M/S Sohel Agro Traders (Prop. Shaikh Kalim Shaikh Rukamoddin),"A/P Dharmapuri, Tal. Parli Vaijnath, Dist. Beed",,,1000.0
605,Cold Storages,Beed,Navin Warehouse(Prop. Nirmala S. Totala),"At. Tokwadi, Tal. Parli-Vaijnath",,,1005.0
606,Cold Storages,Beed,S R Aghav & Others 3,"A/P Sardgaon, Tal. Parali, Dist. Beed",,,5295.0
607,Cold Storages,Beed,Satish Khanderao Kallurkar,"A/P Nivgha, Tal. Hadgaon, Dist. Nanded",,,602.0
608,Cold Storages,Beed,Sau Sagarbai Dhondiram Chavan,"At : Chanai, Post & Tal: Ambajogai, Dist: Beed",,,2000.0
609,Cold Storages,Beed,Shaikh Khalidabi Shaikh Rukhmoddin,"A/P Dharmapuri, Tal. Parli Vaijnath, Dist. Beed",,,170.07
610,Cold Storages,Beed,Shri Jagan Nanasaheb Kirdant,"Gno-9,At Pimpla(Dhayguda),Tq.Ambajogai",,,1001.18
611,Cold Storages,Beed,Shri Sandip RAjusing Naik,"Sno-7/1,Itawa,Tq.Pusad",,,5184.0
612,Cold Storages,Beed,Shri Yogeshwari Warehouse,"Sno-91/1,Gno-276,Digol Amba,Ambajogai",,,999.9
613,Cold Storages,Beed,Shri. Ganesh Ramchandra Katruwar,Bramhawadi,,,1600.0
614,Cold Storages,Beed,Shri. Harish Ramchandra Katruwar,Bramhawadi,,,1000.0
615,Cold Storages,Beed,Shri. Uday Kanchanrao Katruwar,Bramhawadi,,,700.0
616,Cold Storages,Beed,Smt Moharbai Prabhakar Nagargoje,"R/O: Devgaon, Tal: Kaij, Dist: Beed",,,3000.0
617,Cold Storages,Beed,Vishnukumar Pandurangji Jaju,"Sno-376,Ambajogai,Dist.Beed",,,993.366
618,Cold Storages,Bhandara,"Chikhali VKS, Chikali",Chikali,,,150.0
619,Cold Storages,Bhandara,Gopichand Tikaramji Raut,"AT POST KINHALA,TQ LakhandurdIST BHANDARA",,,330.0
620,Cold Storages,Bhandara,Ku. Nalu Manikrao Karemore,"T.Sr.No.24,At Mohagaon,Tq.Mohadi",,,1326.77
621,Cold Storages,Bhandara,Late N.W.Patil Rice Mill Lakhani,Lakhani,,,1700.0
622,Cold Storages,Bhandara,Late Nirdhanrao Waghaye Patil Krishi Prakriya Udyog Co-Op.Society,Lakhani,,,1000.0
623,Cold Storages,Bhandara,Laxmi Rice Mills ( Prop: Smt Chhayavati Dinanath Patle),"At Post; Salebhata, Tal: Lakhani, Dist: Bhandara",,,595.9
624,Cold Storages,Bhandara,M/S APMC Lakhani,Lakhani,,,550.0
625,Cold Storages,Bhandara,M/S Paoni VKS,Paoni,,,250.0
626,Cold Storages,Bhandara,M/S Sihora Cooperative Rice Mill,Sihora,,,320.0
627,Cold Storages,Bhandara,M/S VKS Sah. Sanstha Bodra,Bodra,,,100.0
628,Cold Storages,Bhandara,"Mehekar Tal. Pra., Sah. Sanstha M., Dongaon, Bramhpuri.",Bramhpuri,,,1000.0
629,Cold Storages,Bhandara,Mr Sanghpal Yashwant Bansod,"Vill: Madeghat, Post: Pimpalgaon, Tah: Lakhandur, Dist: Bhandara",,,500.0
630,Cold Storages,Bhandara,Mr. Ramdas Sitaram Kapase,"Gno-570/3,Palandar,Tq:Lakhani",,,248.4
631,Cold Storages,Bhandara,Mrs. Geetabai Gopal Lanjewar,"Gno-321,Mz:Thana,Tq& Dist.Bhandara",,,343.551
632,Cold Storages,Bhandara,Mrs. Leelabai Mainkrao Karemore,"T.Sr.No.24,At Mohagaon,Tq.Mohadi",,,1326.77
633,Cold Storages,Bhandara,Mrs. Ranjita Raju Karemore,"T.Sr.No.24,At Mohagaon,Tq.Mohadi",,,1326.77
634,Cold Storages,Bhandara,Mrs. Sushma Vijay Karemore,"T.Sr.No.24,At Mohagaon,Tq.Mohadi",,,1326.77
635,Cold Storages,Bhandara,"P Kepar VKS, P Kepar",PIndividual Kepar,,,300.0
636,Cold Storages,Bhandara,Sau Sheela Suresh Karemore,"At: Village Mangli, Post: Khapa, Tah: Tumsar, Dist: Bhandara",,,515.71
637,Cold Storages,Bhandara,Shri Kushan Pundlik Parshuramkar,"Gno-1275,P.H.No.24,At & Tq.Lakhandhur",,,706.253
638,Cold Storages,Bhandara,Shri Lokchand Mohan Raut,"Gno-592/2,At Satalwada,Tq.Sakoli",,,559.0
639,Cold Storages,Bhandara,Shri Manohar Sadashiv Hatawar,"Plot-3,At & Tq. Lakhandur",,,703.39
640,Cold Storages,Bhandara,Shri Mukesh Nanakram Sahajwani,"Sno-355,Kinhala,Tq. Lakhandur",,,1077.65
641,Cold Storages,Bhandara,Shri Nandlal Kisanji Dhore & Shri Manohar Kisanji Dhore,"R/O: Chapral, Po: Soni, Tal: Lakhandur, Dist: Bhandara",,,680.0
642,Cold Storages,Bhandara,Shri Prakash Vithalrao Panchbhai,"T.S.No.20,Gr.25/2, At Yenola,Tq.Pauni,Bhandara",,,934.56
643,Cold Storages,Bhandara,Shri Vinayak Somaji Burade,"Gno-137,Mz:Kawadsi,Tq.Lakhani",,,943.8
644,Cold Storages,Bhandara,Shri Vithalrao Sambhuji Panchbhai,"T.S.No.20,Gr.25/1, At Yenola,Tq.Pauni,.Bhandara",,,934.56
645,Cold Storages,Bhandara,Shri. Rameshwar Manik Rao Karemore,Mouza - Warthi,,,1440.0
646,Cold Storages,Bhandara,Smt Shantabai Shrikisan Selokar,"Ph No. 58/6, Gat No. 83/1, Mouza: Shahapur, Tal & Dist: Bhandara",,,1000.0
647,Cold Storages,Bhandara,Smt. Lata Sukhalal Bisen,"Gno-185,Mz:Kinhala,Tq.Lakhandur",,,469.8
648,Cold Storages,Bhandara,Sou. Rekha Vijay Bansod,"Mz:Jambhali(Sadak),Tq.Sakoli,Dist.Bhandara",,,1199.54
649,Cold Storages,Bhandara,"Vividh Karyakari Seva Sahakari Sanstha, Puyar","At: Puyar, Tal: Lakhandur, Dist: Bhandara",,,108.0
650,Cold Storages,Buldhana,"APMC, Nandura",Nandura,,,119.0
651,Cold Storages,Buldhana,Adishakti Muktabai Gramin Bigar Sheti Coop. Society,Asalgaon,,,248.0
652,Cold Storages,Buldhana,Amle Godown ( Maroti Pundlik Amle),"Gat No. 69, At: Bhadgani, Buldhana Road, Tah: Malkapur, Dist: Buldhana",,,225.0
653,Cold Storages,Buldhana,Anjali Ajay Umalkar,"A/P Anjani Budruk, Gut. No.545, Taluka Mehkar, Dist. Buldana",,,1670.0
654,Cold Storages,Buldhana,Annasaheb Ganpatrao Burkul,"Sr.No.55,At & Tq.Sindhkhedraja",,,259.328
655,Cold Storages,Buldhana,Asalgaon V.K.Coop. Society,Asalgaon,,,200.0
656,Cold Storages,Buldhana,Ashok Banduji Patil,"Gut. No.275, Satgaon- Bhusari, Chikhali",,,102.938
657,Cold Storages,Buldhana,Ashtavinayak Gramin Bigarsheti Coop Credit Society Ltd,"Janephal, At Post: Janephal, Tal: Manchar, Dist: Buldhana",,,990.0
658,Cold Storages,Buldhana,"B.B.Sancheti, R.B.Sancheti, S.B.Sancheti",At Lonar Buldana,,,979.0
659,Cold Storages,Buldhana,Balaji Urban Co-Operative Credit Society Ltd.,"B-9,Midc,Chikhali,Dist.Buldana",,,1416.84
660,Cold Storages,Buldhana,Bansilal Dasuji Rathod,"Gat No. 21, Mouza Palaskhed Nago, Tal. Buldana",,,524.312
661,Cold Storages,Buldhana,Bharat Suryabhan Kalekar,"At Kelwad, Tq.Chikhli",,,100.0
662,Cold Storages,Buldhana,Bhaurao Awachitrao Warge,"At. Karmoda, Tal. Sangrampur",,,160.0
663,Cold Storages,Buldhana,Bhaurao Awachitrao Warge Patil,"At. Karmoda, Tal. Sangrampur",,,160.0
664,Cold Storages,Buldhana,Buldana Arban Coop. Credit Society,Buldhana,,,500.0
665,Cold Storages,Buldhana,Buldhana Urban Co-Op Credit Society Ltd,"Gut No 421,Janephal,Gut No 164 Tembhurna, Tal. Khamgaon, Dist. Buldhana",,,9414.0
666,Cold Storages,Buldhana,Buldhana Urban Co-Op Credit Society Ltd,"GUT No565 MOUJE:RAIPUR,TQ CHIKHALI,DIST:BULDHANA",,,916.0
667,Cold Storages,Buldhana,Buldhana Urban Co-Op Credit Society Ltd,"GUT NO 210 AT KUMBHEPHAL ,TQ BULDHANA,DIST.BULDHANA &GUT NO 216S.NO 216 AT DONGARKHANDALA Tq & Dist BuldhanaI",,,5931.0
668,Cold Storages,Buldhana,Buldhana Urban Coop. Credit Soc. Ltd,Buldhana,,,533.0
669,Cold Storages,Buldhana,Buldhana Urban Coop. Credit Soc. Ltd,Buldhana,,,533.0
670,Cold Storages,Buldhana,Buldhana Urban Coop. Credit Soc. Ltd,Buldhana,,,368.0
671,Cold Storages,Buldhana,Deokar Ware House (Prop: Rameshkumar Pralhad Deokar),"At Post: Kalambeshwar, Tal: Mehkar, Dist: Buldhana",,,998.0
672,Cold Storages,Buldhana,Dilip Narayanrao Thaokare,Kalyana,,,100.0
673,Cold Storages,Buldhana,"G.B.Sancheti, N.B.Sancheti, S.B.Sancheti",At Lonar Buldana,,,959.0
674,Cold Storages,Buldhana,Gangaram Laxman Dhumal,Jambhul,,,140.0
675,Cold Storages,Buldhana,Jalgaon Jankalyan Nagri Sahakari Pathasanstha Ltd. (Jalgaon Jamod),"Gat No.450, A/P Sonala-2, Tal. Sangrampur, Dist. Buldana (MS), Pine 443 204",,,961.84
676,Cold Storages,Buldhana,Jawahar Arban V.K.S.,Chikhali,,,1000.0
677,Cold Storages,Buldhana,Jawahar Urban Co-Op Credit Sty. Ltd.,"P-2,Midc Area,Chikhali",,,1411.69
678,Cold Storages,Buldhana,Keshav Urban Co-Operative Sty. Ltd.,"Gno-177,Tunki,Tq.Sangrampur",,,501.39
679,Cold Storages,Buldhana,"Keshav Urban Credit Co-Operative Socy Ltd ,Shegaon Dist Buldhana.",Tunki Tal Sangrampur Dist Buldhana,,,501.38
680,Cold Storages,Buldhana,Kotwal Employees Credit Coop. Society,Nandura,,,550.0
681,Cold Storages,Buldhana,Kotwal Karmachari Sah.Pat Sanstha Ltd.,"Gno-67,Mz:Wadi,Tq.Nandura,Buldana",,,502.006
682,Cold Storages,Buldhana,Kundlik Deaorao Magar,Deulgaon Mali,,,501.0
683,Cold Storages,Buldhana,M.G.Chandak,Individual Khed,,,150.0
684,Cold Storages,Buldhana,M/S APMC Deulgaonraja,Deulgaonraja,,,300.0
685,Cold Storages,Buldhana,M/S APMC Paoni Sub Market Asgaon,Asagaon,,,1000.0
686,Cold Storages,Buldhana,M/S Balagad Warehouse(Shri Bharat Sampatrao Ingle),"Sno-25/4,Sajanapuri,Tq:Khamgaon",,,990.0
687,Cold Storages,Buldhana,M/S Gavilgad Warehouse,Sajanpuri,,,990.0
688,Cold Storages,Buldhana,M/S Gurudeo Ware House (Prop. Shri Dinesh Rajesh Jethani),"Plot-P-37,Midc Area,Chikhali,Tq.Chikhali",,,816.261
689,Cold Storages,Buldhana,M/S Jagdamba Trading Co.,Anjani Bk,,,2648.8
690,Cold Storages,Buldhana,M/S Jagdamba Trading Company,"Gat No. 544, Anjani(BK), Tal. Mehkar",,,2618.39
691,Cold Storages,Buldhana,M/S Janjiragad Warehouse,Sajanpuri,,,990.0
692,Cold Storages,Buldhana,M/S Jijau Individual Ustries (Prop.Smt. Rekhatai Purushottam Khedekar),"Plot-A-1,Midc Area,Chikhali,Tq.Chikhali",,,1223.17
693,Cold Storages,Buldhana,M/S Kailashgad Warehouse,Sajanpuri,,,990.0
694,Cold Storages,Buldhana,M/S Khadakpurkar Warehouse (Prop. Surendra Sumatisa Khapurkar),"Plot No. P-1,2,21,22, S No. 44 45 46/2, G No. 188, At: Kumbhari, Tal: Deulgaon Raja, Dist: Buldhana - 443204",,,901.0
695,Cold Storages,Buldhana,"M/S Kothari Associates,Chikhali","Plot No.P-16,MIDC Area,Chikhali",,,2460.0
696,Cold Storages,Buldhana,M/S Kothari Warehouse (Prop.Shri V.G Kothari),"Plot-21,MIDC Area, A/P-Chikhali",,,1000.0
697,Cold Storages,Buldhana,M/S Nital Warehouse,Khaperkhada,,,1137.0
698,Cold Storages,Buldhana,M/S Palak Warehouse,Khaperkhada,,,853.0
699,Cold Storages,Buldhana,M/S Purohit Warehouse,Undri,,,536.0
700,Cold Storages,Buldhana,M/S R S Kothari & Co.,Chikhli,,,1188.0
701,Cold Storages,Buldhana,M/S Raigad Warehouse,Sajanpuri,,,990.0
702,Cold Storages,Buldhana,M/S Rajarshi Shahu Gramin Sah. Patsanstha Ltd.,"At Post Shirpur, Tal. & Dist. Buldana",,,850.0
703,Cold Storages,Buldhana,M/S Rajeshwar Warehouse,"Gut. No. 232, At Waghud, Malkapur",,,1902.9
704,Cold Storages,Buldhana,M/S Rajlaxmi Warehousing & Agro Processing,"GNo. 202,Asola Jahagir,Tq. Deolgaon Raja,",,,5600.0
705,Cold Storages,Buldhana,M/S Ramai Warehousing Services (Prop. Smt Lata Suresh Bugdani),"Gat No.68, A/P Pimpalner, Tal. Deulgaon Raja, Dist. Buldhana",,,390.0
706,Cold Storages,Buldhana,M/S Saiyadrigad Warehouse,Sajanpuri,,,990.0
707,Cold Storages,Buldhana,M/S Sanjay Jaywantrao Ugale,Ugala,,,150.0
708,Cold Storages,Buldhana,M/S Satyajit Trading Co,"Gat No. 65/2, At: Kandaladevi Mehkar, Dist: Buldhana",,,2000.0
709,Cold Storages,Buldhana,M/S Savitrigad Warehouse,Sajanpuri,,,990.0
710,Cold Storages,Buldhana,M/S Shanti Warehouse,"Gat. No. 48, Mouza Bahapura, Tal. Malkapur",,,992.0
711,Cold Storages,Buldhana,M/S Sharda Warehouse(Mrs.Sunita Gadodia),"Gno.24, Village:Chincholi,Tq:Shegaon",,,999.0
712,Cold Storages,Buldhana,M/S Shikha Warehouse,Khaperkhada,,,853.0
713,Cold Storages,Buldhana,M/S Shital Warehouse,Khaperkhada,,,1137.0
714,Cold Storages,Buldhana,M/S Shivnergad Warehouse,Sajanpuri,,,990.0
715,Cold Storages,Buldhana,M/S Sinhgad Warehouse,Sajanpuri,,,856.0
716,Cold Storages,Buldhana,M/S Swarngad Warehouse,Sajanpuri,,,990.0
717,Cold Storages,Buldhana,M/S Virchand Narsi,Malkapur,,,4158.0
718,Cold Storages,Buldhana,M/S Virchand Narsi Cotton Pvt. Ltd.,"Gat. No.77/3, N.H. No.6, Malkapur",,,1325.0
719,Cold Storages,Buldhana,M/S Virchand Narsi Cotton Pvt. Ltd.,"Gat. No.77/3, N.H. No.6, Malkapur",,,3929.0
720,Cold Storages,Buldhana,Maa Bhagwati Warehouse (Sa.Reena Tushar Agrawal),"Gno-175,At Lasura,Tq:Shegaon",,,999.18
721,Cold Storages,Buldhana,Maharashtra State Warehousiing Corporation (3 Units),"Varkehd (Kh.), Gut No.93, Tal. Khamgaon, Dist. Buldhana, MIDC Khamgaon",,,4500.0
722,Cold Storages,Buldhana,Maharashtra State Warehousing Corporation,"Mkt.Yard,Jaisinghpur",,,1759.38
723,Cold Storages,Buldhana,Maharashtra State Warehousing Corporation,Mkt Yard-Chandur Bazar,,,1759.38
724,Cold Storages,Buldhana,Maharashtra State Warehousing Corporation,"Mkt Yard,Morgaon-A",,,1759.38
725,Cold Storages,Buldhana,Maharashtra State Warehousing Corporation,"Midc,Mkt Yard,Nandgaon Khandeswar",,,1759.38
726,Cold Storages,Buldhana,Mehkar Taluka Praymary Teacher Coop. Credit Society,Mehkar,,,1740.0
727,Cold Storages,Buldhana,Mr. Bhimrao Rambhau Adwe,"Gno-77,At Malvihir,Tq:Buldana",,,103.754
728,Cold Storages,Buldhana,Mr. Chhagan Vinayakrao Wankhede,"Gno-83,Wadi,Tq:Chikhali",,,200.0
729,Cold Storages,Buldhana,Mr. Laxman Shamrao Lambe,"Gno-69,At Malkhed,Tq.Mehkar",,,122.842
730,Cold Storages,Buldhana,Mr. Ragho Shriram Ambhore,"Gno-381,Bramhmapuri,Tq:hikhali",,,200.0
731,Cold Storages,Buldhana,Mr. Sanjay Purnaji Tekale,"Gno-93,At Mz:Ruikhed,Tq.Buldana",,,240.0
732,Cold Storages,Buldhana,Mrs. Kaveri Gajanan Nagare,"Gno-269,Baigaon,Tq.Deulgaon Raja",,,433.636
733,Cold Storages,Buldhana,Mukhtar Sk Taher,Mehkar,,,1672.0
734,Cold Storages,Buldhana,"Mukteshwar Narayan Jadhav,Yaesgaon",Dongaon,,,945.0
735,Cold Storages,Buldhana,Mundada Warehouse,"Gno-24,Mz:Khaparkheda,Tq.Malkapur",,,982.933
736,Cold Storages,Buldhana,Nalganga Falabag Utpadak Kharedi Vikri Coop. Society Talni,Talni,,,200.0
737,Cold Storages,Buldhana,Pimpalgaon Sarai Gramin Bigarsheti Coop Credit Soc Ltd,"At Post: Pimpalgaon Sarai, Tal: Buldana, Dist: Buldhana",,,800.0
738,Cold Storages,Buldhana,Prabhuji Warehouse,Chikhli,,,2141.0
739,Cold Storages,Buldhana,Pradip Sopan Borale,"At Post: Tandulwadi, Tal: Malkapur, Dist: Buldhana",,,992.93
740,Cold Storages,Buldhana,Prakash Marotrao Itankar,Mohalgaon,,,300.0
741,Cold Storages,Buldhana,Pravin Ruprao Sawale,"Gno-16,Dongarkihandala,Tq.Buldana",,,127.637
742,Cold Storages,Buldhana,Radhakrushna Urban Coop.Credit Soceity,Malkapur,,,608.0
743,Cold Storages,Buldhana,Rajendra Babulal Agrawal,Chikhali,,,1106.0
744,Cold Storages,Buldhana,Rameshwar Mahadeo Raut,"At Po. Lakhanwada, Tal: Khamgaon, Dist: Buldhana",,,200.0
745,Cold Storages,Buldhana,Ritayu Warehouse,"Gno-23,Khaparkheda,Tq.Malkapur",,,1626.01
746,Cold Storages,Buldhana,Sanjaykumar Gulabsingh Dangar,"At : Taroda, Po: Kothali, Tal: Motala, Dist: Buldhana",,,337.0
747,Cold Storages,Buldhana,Santosh Sampatrao Thokare,Kalyana,,,100.0
748,Cold Storages,Buldhana,Satyajit Wasantrao Mujumale,"Gat No. 371, Vill: Akoli, Teh: Khamgaon, Dist: Buldhana",,,200.0
749,Cold Storages,Buldhana,Sau Deepali Bhushan Umalkar (Godown 2),"Gat No. 65/2, At: Khandala, Tal: Mehkar, Dist: Buldhana",,,999.38
750,Cold Storages,Buldhana,Sau Lata Ramdas Shejol,Dongarkhandala,,,100.0
751,Cold Storages,Buldhana,Sau Radha Shyam Umalkar,"Gat No. 65/2, At: Khandala, Tal: Mehkar, Dist: Buldhana",,,1000.0
752,Cold Storages,Buldhana,Sau Radha Shyam Umalkar (Godown 2),"Gat No. 65/2, At: Khandala, Tal: Mehkar, Dist: Buldhana",,,999.38
753,Cold Storages,Buldhana,Sau Rama Anil Laddha,"S No. 148, Jaulka Rly, Tal: Malegaon, Dist: Buldhana",,,2400.0
754,Cold Storages,Buldhana,Sau Shantabai Sardarmal Sancheti,"Gat No. 48, At Village: Bahapur, Tal: Malkapur, Dist: Buldhana",,,992.93
755,Cold Storages,Buldhana,Sau. Geetadevi Ashokkumar Rathi,"GNo.31,At Sajanpur,Tq.Khamgaon",,,1068.98
756,Cold Storages,Buldhana,Sau. Kiran Ashok Sancheti,"Gno-358,Gaikhed,Tq.Lonar,Buldana",,,849.627
757,Cold Storages,Buldhana,Sau. Padmadevi Kailash Agrawal,Mauje Warkhed,,,1600.0
758,Cold Storages,Buldhana,Sau. Rajani Dashrath ShInd E,"Gut No. 309, Dusarbid, Tq. SIndividual Khed Raja,",,,995.346
759,Cold Storages,Buldhana,Sau. Seema Harshitl Sancheti,"Gno-358,Gaikhed,Tq.Lonar,Buldana",,,849.627
760,Cold Storages,Buldhana,Sawargaon Nehu V.K.S.,Sawargaon Nehu,,,119.0
761,Cold Storages,Buldhana,Sh. Janardhan Kondappa Kyawal,Dongarkhandala,,,100.0
762,Cold Storages,Buldhana,Sh. Madhukar Dagdu Jeughale,"Gondhankhed, Warwand",,,100.0
763,Cold Storages,Buldhana,Sh. Madhukar Dagduji Kadam,Dongarkhandala,,,114.183
764,Cold Storages,Buldhana,Sh. Shesharao Ananda Savale,Dongarkhandala,,,100.0
765,Cold Storages,Buldhana,Sh.Bhaurao Devrao Taktode,Warwand,,,100.0
766,Cold Storages,Buldhana,Sh.Narayan Dagaduji Kadam,Dongarkhandala,,,100.0
767,Cold Storages,Buldhana,Shanti Agro Services,"Plot No. P-17, MIDC, Chikhali, Dist: Buldhana",,,2520.0
768,Cold Storages,Buldhana,Shivani Warehouse( Prop: Mrs Harsha Sanjay Dongaonkar),"At: Pimpalner, Sindkhed Raja Road, Deulgaon Raja - 443204",,,2003.0
769,Cold Storages,Buldhana,Shreeji Warehouse (Prop. Rameshchandra Champalal Dangra),"S.No. 1389 (Part), At Chincholi, Khamgaon Road, Tal. Shegaon, Dist. Buldhana",,,2277.26
770,Cold Storages,Buldhana,Shri Ajay Arvind Umalkar & Sou Rajeshwari Prataprao Jadhav ( Jagdamba Trading Company),"At Post: Anjni Bk, Gut No. 545, Taluka: Mehkar, Dist: Buldhana",,,3666.29
771,Cold Storages,Buldhana,Shri Ambika Urban Credit Sahakari Sanstha Maryadit,Anjani Kh.,,,1774.0
772,Cold Storages,Buldhana,Shri Arvind Onkarappa Bendade,"At Po. Sakharkherda, Tal: Sindkhed Raja, Dist: Buldhana",,,500.0
773,Cold Storages,Buldhana,Shri Ashok Kanahyalal Sancheti,"S.No.214/7, Lonar, Buldhana",,,708.822
774,Cold Storages,Buldhana,Shri Chandrasing Mansing Ghoti,"At Kurha,Tq.Motala",,,202.5
775,Cold Storages,Buldhana,Shri Damodar Balkrishna Dhoot,"G.No. 466, Datala,Tq. Malakapur",,,301.0
